Category_Names,Product_Names
mazon.com : Office Footrests,Mount-It! Ergonomic Under Desk Footrest | Massaging Foot Rest Support | Tilting Footrest with 3-Level Height Adjustment | Under Chair Office Footrest
mazon.com : Office Footrests,EverRest Foot Rest Under Desk for Office Use - Warmer Feet 3 Adjustable Heights - Tall Ergonomic Footrest Stool for Gaming Chair Computer - Leg Support for Work from Home
mazon.com : Office Footrests,Fellowes 48121 Standard Foot Rest Graphite
mazon.com : Office Footrests,The Original Everlasting Comfort Foot Rest Under Desk for Office Use All-Day Pain Relief and Leg Support Stool Under Desk Foot Rest Ergonomic for Home Office Work Gaming Accessories
mazon.com : Office Footrests,Ywbtflul Foot Rest for Under Desk at Work Ergonomic 6 Heights Adjustable Footrest with Massage Roller Portable Under Desk Foot Stool for Home Office Black
mazon.com : Office Footrests,Foot Rest for Under Desk at Work New Upgrade Wooden with Metal Ergonomic Foot Rest Under Desk Office Foot Rest Under Desk Pressure Relief for Back and Body Comfort Matte Black Footrest
mazon.com : Office Footrests,Scalebeard Under Desk Footrest with Massage Surface Ergonomic 6 Height Position Adjustable Foot Stool with Firm Non-Slip Legs for Home Office(Basic)
mazon.com : Office Footrests,Vhelyom Foot Rest for Under Desk at Work Height Adjustable Footrest with Massage Roller and Soft Pad Foldable Ergonomic Foot Rest for Car Underdesk Home Train(Black)
mazon.com : Office Footrests,EUREKA ERGONOMIC Tilt Adjustable Footrest Foot Rest for Under Desk at Work with Massage Surface Office Foot Rest Under Desk with 20 Degree Tilt No Locking Metal Frame
mazon.com : Office Footrests,CONSDAN Foot Rest Ergonomic Footrest for Under Desk at Work Nursing Foot Stool Natural Solid Wood Non-Slip Slanted Top Foot Stool for Office/Standing Desk(Chocolate Color)
mazon.com : Office Footrests,DISFAT Ergonomic Foot Rest Under Desk at Work Rocking Foot Stool Footrest Footrest with Foot Massage Feet Stand Promote Leg Circulation Massage Feet Stand for Office &amp; Home(Black)
mazon.com : Office Footrests,CZZXI Rocking Foot Rest for Under Desk at Work Comfortable Foot Stool Ergonomic Footrest with Foot Massage Feet Stand for Office &amp; Home
mazon.com : Office Footrests,Auslar Foot Rest for Under Desk at Work Ergonomic Adjustable Foot Rest with Massage Texture Board Under Desk Foot Stool for Office Home
mazon.com : Office Footrests,Ochine Foot Rest for Under Desk at Work 2023 New Ergonomic Adjustable Foot Stool Cushion Under Desk Footrest with Handle Non-Slip Surface for Car Home and Office to Relieve Back Lumbar Knee Pain
mazon.com : Office Footrests,Evfiuha Under Desk Foot Rest and Office Desk Accessory Ergonomic Foot Rest for Office Use All-Day Pain Relief and Leg Support Stool Desk Footrest for Work Gaming and Home Office Women Gift (Flat)
mazon.com : Office Footrests,Cushion Lab Ergonomic Foot Rest for Under Desk – Patented Massage Ridge Design Memory Foam Foot Stool Pillow for Work Home Gaming Computer Office Chair – Footrest for Back &amp; Hip Pain Relief
mazon.com : Office Footrests,PACEARTH Foot Rest Under Desk Larger Size Office Desk Footrest Rocking Foot Nursing Stool Rocker Balance Board Ergonomic Design for Posture Support Office and Home Use(17x13x4 inch)
mazon.com : Office Footrests,Foot Rest for Under Desk at Work – Adjustable Foam Footrest for Office &amp; Home – Ergonomic Foot Stool for Gaming &amp; Computer Chair – Cushion for Back &amp; Leg Pain Relief - Dark Gray Mesh
mazon.com : Office Footrests,Foot Rest for Under Desk at Work Adjustable Desk Footrest for Office Chair &amp; Gaming Chair Ergonomic Footrest Pillow Desk Foot Stool for Home Airplane Car to Relieve Back Knee Pain
mazon.com : Office Footrests,5 Height Adjustable Foot Rest Ergonomic Footrest Under Desk at Work with Sponge Bar Support for Back &amp; Hip Pain Relief Comfortable Anti-Slip Bamboo Foot Tool with Foot Massage for Home Office
mazon.com : Letter Trays &amp; Stacking Supports,EDHAS Letter Trays &amp; Stacking Supports Acacia Wood Desk Document File Folder Magazine Holder Tray (14 x 11 x 2)
mazon.com : Letter Trays &amp; Stacking Supports,Tomorotec Desk Letter Tray Set A4 Size Clear PET Stackable Document Organizer Office Desktop File Paper Holder Book Storage Rack Side Load Anti-Skid Stacking Support Convex Bottom (2X Landscape)
mazon.com : Letter Trays &amp; Stacking Supports,Rubbermaid Regeneration Letter Tray Six Tier Plastic Black
mazon.com : Letter Trays &amp; Stacking Supports,EZSTAX File Organizers - Letter Size Stackable Trays for Desk - for Office Files Mail Documents - 12 Pack Clear
mazon.com : Letter Trays &amp; Stacking Supports,Supeasy 5 Tier Desk Organizer with Handle Mesh Paper/File Organizer for Desk Paper Tray Organizer for Office Supplies Black
mazon.com : Letter Trays &amp; Stacking Supports,CiWiVOKi Set of 4 Office Organization and Storage Clear PET Letter Tray Desk Organizer Stackable Document Organizer for Notes Pens File Paper Desk
mazon.com : Letter Trays &amp; Stacking Supports,Clear Stackable Paper Trays 4 Pack Desktop Racks PET Clear Desk Letter Tray Set Stackable Desk Organizer for Books Magazines Folders A4 Size File Paper Notes Pens (Clear)
mazon.com : Letter Trays &amp; Stacking Supports,Ballucci File Organizer Paper Sorter 5 Tier Adjustable Shelves Office Desk Organizer 13 5/8 x 9 1/4 x 12 Gray
mazon.com : Letter Trays &amp; Stacking Supports,GoldOrcle 8 Tier Paper Letter Tray Organizer with Handles Mesh Desk File Holder Storage Organization for Office School Desktop
mazon.com : Letter Trays &amp; Stacking Supports,Marbrasse Mesh Desk Organiser Tray 6 Tier Letter Tray Organiser with Hander Office Trays Desk Organiser Accessories Paper Tray Organiser for A4 File Holder - Black
mazon.com : Letter Trays &amp; Stacking Supports,Samstar Paper Letter Tray 3 Tier Desk File Organizer Paper Sorter Letter Shelf Rack Mesh Made Black ...
mazon.com : Letter Trays &amp; Stacking Supports,Aimeaihe Stackable Paper Letter Tray Organizer 4 Tier Desk Organizers and Accessories Mesh Desk Organizer with File Holder for Office Supplies (Black)
mazon.com : Letter Trays &amp; Stacking Supports,Marbrasse Desk Organizer with File Holder 5-Tier Paper Letter Tray Organizer with Drawer and 2 Pen Holder Mesh Desktop Organizer and Storage with Magazine Holder for Office Supplies(Black)
mazon.com : Letter Trays &amp; Stacking Supports,gianotter Paper Letter Tray Organizer with File Holder 4-Tier Desk Accessories &amp; Workspace Desk Organizers with Drawer and 2 Pen Holder for Office Supplies (Rose Gold)
mazon.com : Letter Trays &amp; Stacking Supports,AUPSEN Desk Organizer with File Holder 5 Trays Paper Letter Tray Organizer Mesh Desk Organizers and Accessoriesand for Home Office (Rose Gold)
mazon.com : Letter Trays &amp; Stacking Supports,ohlela 2 Pack Stackable Paper Tray for Desk - A4 Size Clear PET Desk Letter Tray for Desk Paper Organizer - Space Saving Letter Trays &amp; Stacking Supports for Office Home School Desk Organization
mazon.com : Letter Trays &amp; Stacking Supports,Yeaqee 4 Tier Stackable Paper Tray Gold Desk Organizer Rack Metal Letter Desk File Organizer Horizontal Holder File Trays for Desk Office Desktop School Supplies and Accessories
mazon.com : Letter Trays &amp; Stacking Supports,5 Tier Paper Letter Tray Organizer with Handles VIEERINN Mesh Desk File Organizer Metal Paper Sorter Holder Desktop Document Shelf Tray Storage Organization for Office School Home
mazon.com : Letter Trays &amp; Stacking Supports,DALTACK 3 Tier Letter Tray Paper Organizer Mesh Metal Desk File Organizer for Home &amp; Office Black
mazon.com : Letter Trays &amp; Stacking Supports,Innovative Storage Designs Stackable Letter Trays Black Pack Of 6
mazon.com : Letter Trays &amp; Stacking Supports,Simple Trending 7 Tier Desk File Organizer Letter Tray Paper Organizer with Pen Holder and Metal Hanging Basket Black
mazon.com : Letter Trays &amp; Stacking Supports,VETUZA 5 Tier Paper Letter Organizer Tray for Desk Mesh Desk File Organizer Paper Organizer for Desk Letter Tray Organizer for Office Home School Black
mazon.com : Letter Trays &amp; Stacking Supports,Safco Products Onyx Desk Organizer - 2 Horizontal 6 Upright Sections - Black - Metal - Tabletop Desktop Organizer - Office &amp; School Supplies - Letter Trays &amp; Stacking Supports
mazon.com : Letter Trays &amp; Stacking Supports,DAOUTIME 3-Tier Paper Organizer Letter Tray Wooden Desk File Organizer Stackable Metal Mesh Desk Organizer for A4 Printer Paper Storage. Small Paper Trays for Home Office School Rustic Brown
mazon.com : Letter Trays &amp; Stacking Supports,COSYAWN Paper Letter Tray Organizer 7 Tier Mesh File Tray Paper Sorter Desk Organizer for Office Home School Black
mazon.com : Letter Trays &amp; Stacking Supports,LEKETREE Desk Organizers and Accessories 5-Tier Paper Letter Tray Organizer with File Holder Desktop Organizer for Office Supplies Office Desk Accessories &amp; Workspace(Black)
mazon.com : Letter Trays &amp; Stacking Supports,DDYURI Wood Letter-Size Tray for Office Desktop Organizer - Wooden Front-Load Documents Tray for Mail Paper File Magazine Pen Notebook Storage Paper Holder Trays Light(DGTU-LT)
mazon.com : Letter Trays &amp; Stacking Supports,Mesh Office Supplies Desk Organizer Meshist Metal Desktop Document Holder Organizer with 4 Letter Paper Tray and 1 Vertical Section Black
mazon.com : Letter Trays &amp; Stacking Supports,OUTWOLF 8-Tier Paper Organizer Letter Tray Desk Organizer with Handle Paper File Desk Organizers and Storage for Office Organization Supplies
mazon.com : Letter Trays &amp; Stacking Supports,GDINDINFAN 5-Tier Letter Tray Paper Organizer with Handle Mesh Desk File Organizer Paper Sorter Holder Desktop Document Shelf Storage Organization for Office Home or School Black
mazon.com : Letter Trays &amp; Stacking Supports,Desk Letter Tray Set 2 Pack A4 Size Plastic Stackable File Document Organizer Office Desktop File Paper Holder Book Storage Rack Anti-Skid Stacking Support for Office Supplies 13x9.6x2.2 inch
mazon.com : Letter Trays &amp; Stacking Supports,Officemate Recycled Desk Tray Side Load 15 1/8 x 8 7/8 x 15 Letter/A4 6/PK (26212)
mazon.com : Letter Trays &amp; Stacking Supports,Okllen 3 Pack Stackable Paper Trays Bamboo Desk Letter Tray Set 3 Tier File Document Organizer Tray for A4 Paper Magazine Receipts Office Supplies
mazon.com : Letter Trays &amp; Stacking Supports,Acrylic Letter Tray Flymer Clear Paper Organizer for Desk Stackable Acrylic Office Organizer 2 Tier for Letter Trays &amp; Stacking Supports
mazon.com : Letter Trays &amp; Stacking Supports,Reliatronic Mesh Desk Organizer Metal 5 Compartments Organizer with 4 Horizontal Letter Trays and 1 Upright Section for Letters Folders Files Documents and Desk Accessories Gold
mazon.com : Letter Trays &amp; Stacking Supports,WUWEOT Bamboo Paper Letter Tray 15 x 13 x 10.3 Files and Paperwork Organizer Adjustable Desktop Documents Sorter Holder with Drawers for Home Office School Supplies
mazon.com : Letter Trays &amp; Stacking Supports,Crehatos Letter Tray Paper Organizer Stackable Paper Tray Clear Desk Organizer Desk Accessories Tray for Office Home School Supplies 2 Pack Horizontal
mazon.com : Letter Trays &amp; Stacking Supports,2 Tier Letter Tray Paper Organizer Clear Desk Stackable Paper Tray File Organizer A4 Size PET Paper Sorter Tray Stacking Support File Tray Desk Organizer for Office Home or School (Transparent)
mazon.com : Letter Trays &amp; Stacking Supports,24 Packs Plastic Trays for Classroom Stackable Thick Flat Paper Letter Tray Organizer Bin for Teacher Classroom File Book Storage Art Activity Supplies (Multicolor)
mazon.com : Letter Trays &amp; Stacking Supports,izBuy Letter-Size Tray Desk Letter Tray Paper Tray - Single-Tier (1-Pcs) Stackable Desktop Organizer Front-Load Documents Tray for Office Supplies File Plastic Letter Tray
mazon.com : Letter Trays &amp; Stacking Supports,SETTFRFE 4-Tier Letter Tray Desk Organizer Mesh File Stackable Paper Tray Organizer for Desk Desktop Paper Sorter Literature Organizer Rack for Home Office School Black.
mazon.com : Letter Trays &amp; Stacking Supports,Lavatino 5 Tray Desk File Organizer Mesh Paper Sorter Letter Tray Organizer with Handle Desktop File Organizer and Storage for Letter/A4 Office File Folder
mazon.com : Letter Trays &amp; Stacking Supports,LUCYCAZ Paper Tray Organizer for Desk - Desktop File Organizer 4 Tier Stackable Desk Organizer Letter Tray Pink File Organizer for Girls Home School and Office
mazon.com : Letter Trays &amp; Stacking Supports,5 Tier Stackable Letter Tray Office Desk Paper Organizer File Trays Desktop Holder for Paper Letter Accessories with Pen Holder（Black）
mazon.com : Letter Trays &amp; Stacking Supports,Wooden Paper File Organizer Desktop 5 Slots Mail Letter Sorter Paper Holder Magazine Rack for Home and Office Brown
mazon.com : Letter Trays &amp; Stacking Supports,Mindspace 2 Tier Stackable Letter Tray | Paper Tray Desk Organizer | The Mesh Collection Silver
mazon.com : Letter Trays &amp; Stacking Supports,PAG 6-Tier Desktop File Organizer Document Folder Rack Metal Mesh Letter Tray Magazine Holder for Home Office School Black
mazon.com : Letter Trays &amp; Stacking Supports,Leather Letter Tray AUVAHOX Elegant Desk Organizer for Office Supplies Mail Paper File Magazine Perfect Space Saver for Desk - Black
mazon.com : Letter Trays &amp; Stacking Supports,Marbrasse 4-Trays Desk File Organizer with 2 Pen Holder Desktop Hanging File Holder with Drawer Paper Letter Tray Organizer Mesh Office Supplies Desk Paper Organizer for Home Office (Black)
mazon.com : Letter Trays &amp; Stacking Supports,Huolewa Upgraded Portable File Organizer Box with Lid with Plastic Slide Decorative Collapsible Linen Hanging Home/Office Filing System Box for File and Folders Storage (Gray)
mazon.com: File Folder Racks &amp; Holders: Office Products,1-12 of 445 results for</span&nbsp;<span class=a-size-base a-color-state a-text-boldFile Folder Racks &amp; Holders</span</div</div</div<div data-normaliseheight=false class=a-section a-spacing-medium _octopus-search-result-card_style_apbSearchResultsContainer__bCqjb<div class=_octopus-search-result-card_style_apbSearchResultItem__2-mx4<span class=a-declarative data-version-id=v2hrdt6w0jdtp122jn0441sgwu4 data-render-id=rt981dujbjsut2o7el8wvdsbch data-action=puis-card-container-declarative data-csa-c-type=widget data-csa-c-func-deps=aui-da-puis-card-container-declarative data-csa-c-id=b1ucyp-z5cvj6-xaq8n8-8hytap<div class=puis-card-container s-card-container s-overflow-hidden aok-relative puis-expand-height puis-include-content-margin puis puis-v2hrdt6w0jdtp122jn0441sgwu4 puis-card-border<div class=a-section a-spacing-base<div class=a-section a-spacing-none puis-status-badge-container aok-relative s-grid-status-badge-container puis-expand-height<a class=a-link-normal s-underline-text s-underline-link-text s-link-style href=/gp/bestsellers/office-products/490594011/ref=sr_bs_0_490594011_1<span data-component-type=s-status-badge-component class=rush-component data-component-props={&quot;asin&quot;:&quot;B09K5927B5&quot; &quot;badgeType&quot;:&quot;best-seller&quot;} data-version-id=v2hrdt6w0jdtp122jn0441sgwu4 data-render-id=rt981dujbjsut2o7el8wvdsbch<div class=a-row a-badge-region<span id=B09K5927B5-best-seller class=a-badge role=group aria-labelledby=B09K5927B5-best-seller-label B09K5927B5-best-seller-supplementary data-a-badge-supplementary-position=right tabindex=0 data-a-badge-type=status<span id=B09K5927B5-best-seller-label class=a-badge-label data-a-badge-color=sx-orange aria-hidden=true<span class=a-badge-label-inner a-text-ellipsis<span class=a-badge-text data-a-badge-color=sx-cloudBest Seller</span</span</span<span id=B09K5927B5-best-seller-supplementary class=a-badge-supplementary-text a-text-ellipsis aria-hidden=truein File Folder Racks &amp; File Folder Holders</span</span</div</span </a </div<div class=s-product-image-container aok-relative s-text-center s-image-overlay-grey puis-image-overlay-grey s-padding-left-small s-padding-right-small puis-spacing-small s-height-equalized puis puis-v2hrdt6w0jdtp122jn0441sgwu4<span data-component-type=s-product-image class=rush-component data-version-id=v2hrdt6w0jdtp122jn0441sgwu4 data-render-id=rt981dujbjsut2o7el8wvdsbch<a class=a-link-normal s-no-outline href=/Marbrasse-Organizer-Desktop-Magazine-Supplies/dp/B09K5927B5/ref=lp_490594011_1_1?sbo=RZvfv%2F%2FHxDF%2BO5021pAnSA%3D%3D<div class=a-section aok-relative s-image-square-aspect<img class=s-image src=https://m.media-amazon.com/images/I/81utGiRaWvL._AC_UL320_.jpg srcset=https://m.media-amazon.com/images/I/81utGiRaWvL._AC_UL320_.jpg 1x https://m.media-amazon.com/images/I/81utGiRaWvL._AC_UL480_QL65_.jpg 1.5x https://m.media-amazon.com/images/I/81utGiRaWvL._AC_UL640_QL65_.jpg 2x https://m.media-amazon.com/images/I/81utGiRaWvL._AC_UL800_QL65_.jpg 2.5x https://m.media-amazon.com/images/I/81utGiRaWvL._AC_UL960_QL65_.jpg 3xMarbrasse Desk Organizer with File Holder 5-Tier Paper Letter Tray Organizer with Drawer and 2 Pen Holder Mesh Desktop O... data-image-index=1 data-image-load= data-image-latency=s-product-image data-image-source-density=1</div</a</span</div<div class=a-section a-spacing-small puis-padding-left-small puis-padding-right-small<div class=a-section a-spacing-none a-text-center<div class=a-section s-color-swatch-container s-quick-view-text-align-start<div class=a-section s-color-swatch-outer-circle s-color-swatch-pad s-color-swatch-outer-circle-selected<div data-csa-c-swatch-url=/Marbrasse-Organizer-Desktop-Magazine-Supplies/dp/B09K5927B5/ref=cs_sr_dp_1?sbo=RZvfv%2F%2FHxDF+O5021pAnSA%3D%3D data-csa-c-type=link data-csa-c-content-id=color-swatch-link data-csa-c-swatch-position=1 data-csa-c-swatch-is-selected=true data-csa-c-device-type=DESKTOP data-csa-c-device-env=WEB data-csa-c-device-os=UNRECOGNIZED data-csa-c-interaction-events=click data-csa-c-id=20ggqt-120kl2-mkd1gr-j4sj4k<a aria-label=Black class=a-link-normal href=/Marbrasse-Organizer-Desktop-Magazine-Supplies/dp/B09K5927B5/ref=cs_sr_dp_1?sbo=RZvfv%2F%2FHxDF+O5021pAnSA%3D%3D role=button<span class=s-color-swatch-inner-circle-fill style=background-color: #4D4C4A<span class=s-color-swatch-inner-circle-border</span</span</a</div</div<div class=a-section s-color-swatch-outer-circle s-color-swatch-pad<div data-csa-c-swatch-url=/Marbrasse-Organizer-Desktop-Magazine-Supplies/dp/B0BC8H58KZ/ref=cs_sr_dp_2?sbo=RZvfv%2F%2FHxDF+O5021pAnSA%3D%3D data-csa-c-type=link data-csa-c-content-id=color-swatch-link data-csa-c-swatch-position=2 data-csa-c-swatch-is-selected=false data-csa-c-device-type=DESKTOP data-csa-c-device-env=WEB data-csa-c-device-os=UNRECOGNIZED data-csa-c-interaction-events=click data-csa-c-id=vke0qe-6r1go7-kqjttn-avgg6l<a aria-label=3 File Holder With Drawer class=a-link-normal href=/Marbrasse-Organizer-Desktop-Magazine-Supplies/dp/B0BC8H58KZ/ref=cs_sr_dp_2?sbo=RZvfv%2F%2FHxDF+O5021pAnSA%3D%3D role=button<span class=s-color-swatch-inner-circle-fill style=background-color: #686765<span class=s-color-swatch-inner-circle-border</span</span</a</div</div<div class=a-section s-color-swatch-outer-circle s-color-swatch-pad<div data-csa-c-swatch-url=/Marbrasse-Organizer-Desktop-Magazine-Supplies/dp/B0C5MBJZ8V/ref=cs_sr_dp_3?sbo=RZvfv%2F%2FHxDF+O5021pAnSA%3D%3D data-csa-c-type=link data-csa-c-content-id=color-swatch-link data-csa-c-swatch-position=3 data-csa-c-swatch-is-selected=false data-csa-c-device-type=DESKTOP data-csa-c-device-env=WEB data-csa-c-device-os=UNRECOGNIZED data-csa-c-interaction-events=click data-csa-c-id=545zwh-bfj6t4-p1nq65-drs0w7<a aria-label=Desk Organizer with File Holder-01 class=a-link-normal href=/Marbrasse-Organizer-Desktop-Magazine-Supplies/dp/B0C5MBJZ8V/ref=cs_sr_dp_3?sbo=RZvfv%2F%2FHxDF+O5021pAnSA%3D%3D role=button<span class=s-color-swatch-inner-circle-fill style=background-color: #47423E<span class=s-color-swatch-inner-circle-border</span</span</a</div</div<div class=a-section s-color-swatch-outer-circle s-color-swatch-pad<div data-csa-c-swatch-url=/Marbrasse-Organizer-Desktop-Magazine-Supplies/dp/B0BYVNFNNS/ref=cs_sr_dp_4?sbo=RZvfv%2F%2FHxDF+O5021pAnSA%3D%3D data-csa-c-type=link data-csa-c-content-id=color-swatch-link data-csa-c-swatch-position=4 data-csa-c-swatch-is-selected=false data-csa-c-device-type=DESKTOP data-csa-c-device-env=WEB data-csa-c-device-os=UNRECOGNIZED data-csa-c-interaction-events=click data-csa-c-id=m79k7d-vw7uv-i010dj-w20joe<a aria-label=Desk Organizer with File Holder-02 class=a-link-normal href=/Marbrasse-Organizer-Desktop-Magazine-Supplies/dp/B0BYVNFNNS/ref=cs_sr_dp_4?sbo=RZvfv%2F%2FHxDF+O5021pAnSA%3D%3D role=button<span class=s-color-swatch-inner-circle-fill style=background-color: #4E4C4D<span class=s-color-swatch-inner-circle-border</span</span</a</div</div<div class=a-section s-color-swatch-outer-circle s-color-swatch-pad<div data-csa-c-swatch-url=/Marbrasse-Organizer-Desktop-Magazine-Supplies/dp/B0BX8GSZJZ/ref=cs_sr_dp_5?sbo=RZvfv%2F%2FHxDF+O5021pAnSA%3D%3D data-csa-c-type=link data-csa-c-content-id=color-swatch-link data-csa-c-swatch-position=5 data-csa-c-swatch-is-selected=false data-csa-c-device-type=DESKTOP data-csa-c-device-env=WEB data-csa-c-device-os=UNRECOGNIZED data-csa-c-interaction-events=click data-csa-c-id=hzropz-ihrjz9-18sw6t-odzx9e<a aria-label=File Holder With 2 Drawer Organizer class=a-link-normal href=/Marbrasse-Organizer-Desktop-Magazine-Supplies/dp/B0BX8GSZJZ/ref=cs_sr_dp_5?sbo=RZvfv%2F%2FHxDF+O5021pAnSA%3D%3D role=button<span class=s-color-swatch-inner-circle-fill style=background-color: #555355<span class=s-color-swatch-inner-circle-border</span</span</a</div</div<div class=a-section s-color-swatch-outer-circle s-color-swatch-pad<div data-csa-c-swatch-url=/Marbrasse-Organizer-Desktop-Magazine-Supplies/dp/B0BK8KQCJT/ref=cs_sr_dp_6?sbo=RZvfv%2F%2FHxDF+O5021pAnSA%3D%3D data-csa-c-type=link data-csa-c-content-id=color-swatch-link data-csa-c-swatch-position=6 data-csa-c-swatch-is-selected=false data-csa-c-device-type=DESKTOP data-csa-c-device-env=WEB data-csa-c-device-os=UNRECOGNIZED data-csa-c-interaction-events=click data-csa-c-id=h4b4f7-u4kyz1-zbcdi4-ovvogm<a aria-label=Gold class=a-link-normal href=/Marbrasse-Organizer-Desktop-Magazine-Supplies/dp/B0BK8KQCJT/ref=cs_sr_dp_6?sbo=RZvfv%2F%2FHxDF+O5021pAnSA%3D%3D role=button<span class=s-color-swatch-inner-circle-fill style=background-color: #D1BC93<span class=s-color-swatch-inner-circle-border</span</span</a</div</div<div data-csa-c-type=link data-csa-c-content-id=color-swatch-more-link data-csa-c-swatch-more-url=/Marbrasse-Organizer-Desktop-Magazine-Supplies/dp/B09K5927B5/ref=cs_sr_dp_n?sbo=RZvfv%2F%2FHxDF+O5021pAnSA%3D%3D data-csa-c-swatch-remaining-count=+11 data-csa-c-interaction-events=click data-csa-c-id=1vdyo1-5d6jrs-oih27a-2bp4sb<a class=a-link-normal s-color-swatch-link s-hidden-in-quick-view href=/Marbrasse-Organizer-Desktop-Magazine-Supplies/dp/B09K5927B5/ref=cs_sr_dp_n?sbo=RZvfv%2F%2FHxDF+O5021pAnSA%3D%3D role=link<u+11</u</a</div</div</div<div class=a-section a-spacing-none a-spacing-top-small s-title-instructions-style<h2 class=a-size-mini a-spacing-none a-color-base s-line-clamp-4<a class=a-link-normal s-underline-text s-underline-link-text s-link-style a-text-normal href=/Marbrasse-Organizer-Desktop-Magazine-Supplies/dp/B09K5927B5/ref=lp_490594011_1_1?sbo=RZvfv%2F%2FHxDF%2BO5021pAnSA%3D%3D<span class=a-size-base-plus 
Marbrasse Desk Organizer with File Holder 5-Tier Paper Letter Tray Organizer with Drawer and 2 Pen Holder Mesh Desktop Organizer and Storage with Magazine Holder for Office Supplies(Black),
mazon.com: File Folder Racks &amp; Holders: Office Products,Simple Houseware Mesh Desk Organizer with Sliding Drawer Double Tray and 5 Upright Sections Black
mazon.com: File Folder Racks &amp; Holders: Office Products,Fellowes Step File Junior Wire Organizer Rack 6 Sections Black (72613)
mazon.com: File Folder Racks &amp; Holders: Office Products,Simple Trending Mesh Desktop File Sorter Organizer 5-Section Bookshelf for Desk Home Office Black
mazon.com: File Folder Racks &amp; Holders: Office Products,OPNICE Desk Organizers and Accessories Desk Organizer with Drawer 4-Tier Paper Tray Organizer with 2 Pen Holders + File Holder Office Desk Accessories for Office Supplies(Rose Gold)
mazon.com: File Folder Racks &amp; Holders: Office Products,Desktop File Organizer Mail Organizer 7 Compartments Office File Sorter for Easy access to your files Invoices Letters and more - 4.5 Height x 8.8 Width x 5.5 Depth - Black Eco-Friendly
mazon.com: File Folder Racks &amp; Holders: Office Products,Acrimet Horizontal Triple File Folder Holder Organizer (Clear Crystal Color)
mazon.com: File Folder Racks &amp; Holders: Office Products,EASEPRES Vinyl Record Holder Storage 9 Slot Metal Magazine Book Album Display Rack Stylish Triangle Desktop File Sorter Organizer for Home Office
mazon.com: File Folder Racks &amp; Holders: Office Products,Classroom Keepers 12 x 18 Construction Paper Storage 10-Slot White 17 H x 27 W x 19 D 1 Unit
mazon.com: File Folder Racks &amp; Holders: Office Products,3IngSeagulls 5-Tier Rolling File Cart with Hanging File Folders Mobile Desk File Organizer on Lockable Wheels Wood &amp; Mesh Paper Letter Sliding Trays Organization for Office Home School Patent
mazon.com: File Folder Racks &amp; Holders: Office Products,gianotter Desk Organizers and Accessories Office Supplies Desk Organizer with Sliding Drawer Double Tray and 5 Upright Section ​File Sorter Organizer (Rose Gold)
mazon.com: File Folder Racks &amp; Holders: Office Products,VIVSOL Desk Organizer with Mesh File Holder 4-Tier Office Supplies Desk Organizers and Accessories with Sliding Drawers &amp; Pen Holder Desk File Organizer and Storage for Office School Home Black
mazon.com : Office Racks &amp; Displays,Ultimate Office AdjustaView 10-Pocket Desk Reference Organizer with Supplies Storage Base and EZ-Load Pockets to Hold 20 Sheets of Paper Includes Fast Find Indexing Tabs Black Pockets
