Category_Names,Product_Names
mazon.com : Cargo Covers,Arokzn Cargo Cover Compatible with 2021 2022 2023 Nissan Rogue Rear Retractable Trunk Shielding Shade Luggage Privacy Cover(Black)
mazon.com : Cargo Covers,Marretoo for Hyundai Santa Fe Cargo Cover 2019 2020 2021 2022 2023 for Hyundai Santa Fe Accessories Black Retractable Trunk Cover Security Shield Shade
mazon.com : Cargo Covers,Cargo Cover Compatible with 2015-2019 Honda Fit Tazz Style Unpainted Black PU Rear Tonneau Security Cover Non Retractable by IKON MOTORSPORTS 2015 2016 2017
mazon.com : Cargo Covers,ECCPP Rear Cargo Cover Security Shade Retractable Shield 2017-2018 Fit for F-ord Escape 1.5L
mazon.com : Cargo Covers,LINLINS Retractable Trunk Cargo Cover For Nissan Rogue SV S SL 2014-2020 Shade Shield Tonneau Cover Anti-Peeping Luggage Privacy Screen with Canvas Cover(not fit for Rogue Select and Rogue Sport)
mazon.com : Cargo Covers,BOPARAUTO Cargo Cover for Jeep Cherokee Accessories 2019 2020 2021 2022 2023 Rear Trunk Shade Cover(Not fit for Grand Cherokee)
mazon.com : Cargo Covers,DOLKSN Retractable Cargo Cover Fit 2010-2023 Toyota 4Runner Rear Storage Waterproof Cargo Cover Luggage Security Shield Shade
mazon.com : Cargo Covers,Marretoo Cargo Cover for 2014-2016 Subaru Impreza Cargo Cover Black Retractable Trunk Cover for 2013-2017 Subaru Crosstrek XV Accessories
mazon.com : Cargo Covers,Autoxrun Cargo Cover Replacement for Toyota Highlander 2014 2015 2016 2017 2018 2019 Retractable Rear Trunk Cover Luggage Security Shield
mazon.com : Cargo Covers,DrCarNow® for Honda CR-V 2023 Cargo Cover Retractable Rear Trunk Cover Cargo Luggage Privacy Security Shield Shade Compatible with 6th Generation 2023 Honda CRV Accessories
mazon.com : Cargo Covers,Cargo Cover Compatible with 2014-2018 Jeep Cherokee Unpainted Black Vinly+Aluminum Rod Rear Tonneau Security Cover Retractable by IKON MOTORSPORTS 2015 2016 2017
mazon.com : Cargo Covers,BOPARAUTO Cargo Cover for Subaru Forester Accessories 2014-2016 2017 2018 with Back Curtain Rear Trunk Shade Cover (Manual Tailgate)&nbsp;(Not fits for Power Rear gate)
mazon.com : Cargo Covers,XtremeAmazing Trunk Cargo Cover Retractable Shade Compatible with Nissan X-Trail Rogue SV S SL 2014-2020
mazon.com : Cargo Covers,FREEMOTOR802 Compatible with 2019-2023 Toyota RAV4 &amp; RAV4 Prime Rear Cargo Cover Black Vinyl + Aluminum Rod Retractable Rear Trunk Security Cargo Cover Tonneau Added on Bodykit Replacement
mazon.com : Cargo Covers,BOPARAUTO Cargo Cover for Hyundai&nbsp;Tucson Accessories 2016-2020 2021 Rear Trunk Shade Cover
mazon.com : Cargo Covers,BOPARAUTO Cargo Cover for Honda CR-V CRV Accessories 2017 2018 2019 2020 2021 2022 Rear Trunk Shade Cover
mazon.com : Cargo Covers,Liizoo Cargo Cover for Honda Passport 2019 2020 2021 2022 2023 Rear Trunk Cover Trunk Security Cover Shielding Shade Car Accessory Black
mazon.com : Cargo Covers,Volcaner Cargo Cover for 2023 2024 Honda CRV Accessories for Honda CR-V 2023 2024 Hybrid Accessories Retractable Trunk Cover Security Shield Shade Luggage Privacy Screen for Honda CRV(Canvas)
mazon.com : Cargo Covers,NewYall Black Non-Retractable Rear Trunk Cargo Cover Board Tonneau Shade
mazon.com : Cargo Covers,DiffCar 2021 2022 2024 2023 for Hyundai Tucson Cargo Cover for Hyundai Tucson Accessories Security Shade Retractable Trunk Cover Shade for Hyundai Tucson 2021~2024 Accessories
mazon.com : Cargo Covers,X AUTOHAUX Retractable Cargo Cover for Honda CRV 2012-2016 Waterproof Non Slip SUV Rear Trunk Shielding Shade Black
mazon.com : Cargo Covers,SAOKNCE Cargo Cover Fit for 2018-2023 Subaru XV Crosstrek Subaru Impreza Hatchback Rear Storage Waterproof Retractable Rear Trunk Security Cover Shielding Shade Black (Not Fit for Plug-in and Hybrid)
mazon.com : Cargo Covers,NIKALAIKA Cargo Cover for 2023 2024 Honda CRV Upgraded Retractable Rear Trunk Cover Compatible with 6th Generation Honda CR-V Trunk Security Cover Car Accessory Black (Carbon Fiber)
mazon.com : Cargo Covers,CarQiWireless Cargo Cover for Kia Sportage 2023 2024 Retractable Rear Trunk Cargo Cover for Kia Sportage Interior Accessories Waterproof Leather Privacy Security Screen for Cargo Trunk Space
mazon.com : Cargo Covers,MUCO New Cargo Cover for 23 2022 2021 Cadillac Escalade/Escalade ESV Chevy Suburban/Tahoe/GMC Yukon/Yukon XL Retractable Black Rear Trunk Shade Luggage Security Cover
mazon.com : Cargo Covers,ECCPP Rear Cargo Cover Security Shade Retractable Shield Fit for 2007-2013 for A-cura MDX 3.7L Flexible
mazon.com : Cargo Covers,MarretooAuto Original Style Cargo Cover for Mazda CX-5 2017 2018 2019 2020 2021 2022 with Rebounding plastic Trunk Cover
mazon.com : Cargo Covers,ECCPP Rear Cargo Cover Security Shade Retractable Shield 2002-2006 Fit for Honda CR-V 2.4L
mazon.com : Cargo Covers,ECCPP Rear Cargo Cover Security Shade Retractable Shield Fit for 2015-2020 for N-issan Murano 3.5L Flexible
mazon.com : Cargo Covers,X AUTOHAUX Retractable Cargo Cover for Jeep Grand Cherokee 2011-2021 Waterproof Non Slip SUV Rear Trunk Shielding Shade Black
mazon.com : Cargo Covers,FREEMOTOR802 Compatible with 2009-2011 Honda Fit Cargo Cover Board Jazz Style Black Non Retractable Rear Tonneau Shield Parcel Shelf Shade 2010
mazon.com : Cargo Covers,MIXJOY SUV Cargo Liner for Dogs Waterproof Cargo Liner for SUV Pet Dog Cargo Cover Mat with Bumper Flap Protector Nonslip Dog Seat Cover for SUV Trunk Sedans Vans Universal Fit (90 L x 55 W)
mazon.com : Cargo Covers,Cargo Cover Replacement for Chevy Equinox GMC Terrain 2018 2019 2020 2021 2022 2023 Rear Trunk Cover Retractable Security Cover Shielding Shade (Black)
mazon.com : Cargo Covers,ECCPP Rear Cargo Cover Security Shade Retractable Shield 2007-2011 Fit for Honda CR-V 2.4L
mazon.com : Cargo Covers,Marretoo for Honda CRV Cargo Cover 2012 2013 2014 2015 2016 Factory Style Black Retractable Trunk Security Shield Shade
mazon.com : Cargo Covers,SAOKNCE Cargo Cover Fit for 2015-2019 Subaru Outback Rear Storage Waterproof Retractable Rear Trunk Security Cover Shielding Shade Black
mazon.com : Cargo Covers,ECCPP Rear Cargo Cover Security Shade Retractable Shield 2014-2018 Fit for J-eep for Cherokee 3.2L Flexible
mazon.com : Cargo Covers,ECCPP Rear Cargo Cover Security Shade Retractable Shield Fit for 2015-2016 2018-2019 for S-ubaru Outback 2.5L Flexible
mazon.com : Cargo Covers,SAOKNCE Cargo Cover Fit for 2016-2020 Kia Sorento Rear Storage Waterproof Retractable Rear Trunk Security Cover Shielding Shade Black
mazon.com : Cargo Covers,NewYall Rear Trunk Luggage Security Shade Cargo Cover
mazon.com : Cargo Covers,snugcubby SUV Cargo Liner for Dogs 55x91 Dog Cargo Liner for SUV Cargo Mats for Back of SUV Car Trunk Mat for SUV Dog Trunk Cover for SUV with Side Walls Protectors &amp; 2 Pockets
mazon.com : Womens Wrist Watches,Anne Klein Womens Leather Strap Watch
mazon.com : Womens Wrist Watches,Womens T21912 Cavatina
mazon.com : Womens Wrist Watches,Timex Womens T2H331 Black/Silver-Tone/White Watch
mazon.com : Womens Wrist Watches,Anne Klein Womens Bracelet Watch
mazon.com : Womens Wrist Watches,OLEVS Analog Quartz Watch
mazon.com : Womens Wrist Watches,Timex Easy Reader Date Window Watch
mazon.com : Womens Wrist Watches,Anne Klein Womens Bracelet Watch
mazon.com : Womens Wrist Watches,Anne Klein Womens Genuine Diamond Dial Bangle Watch
mazon.com : Womens Wrist Watches,Anne Klein Womens Resin Bracelet Watch
mazon.com : Womens Wrist Watches,Casio Womens LQ139A-1B3 Black Classic Resin Watch
mazon.com : Womens Wrist Watches,Anne Klein Womens Watch with Genuine Diamond Dial
mazon.com : Womens Wrist Watches,Womens Premium Crystal Accented Bangle Watch and Bracelet Set
mazon.com : Womens Wrist Watches,Nine West Womens Crystal Accented Bracelet Watch
mazon.com : Womens Wrist Watches,Nine West Womens Mesh Bracelet Watch
mazon.com : Womens Wrist Watches,Anne Klein Womens Bracelet Watch
mazon.com : Womens Wrist Watches,Anne Klein Womens Bracelet Watch
mazon.com : Womens Wrist Watches,Armitron Sport Womens Digital Chronograph Watch
mazon.com : Womens Wrist Watches,Unisex T2N647 Weekender 38mm Black Nylon Slip
mazon.com : Womens Wrist Watches,Womens Easy Reader 30mm Watch
mazon.com : Womens Wrist Watches,Anne Klein Womens Leather Strap Watch
mazon.com : Womens Wrist Watches,Nine West Womens Strap Watch
mazon.com : Womens Wrist Watches,Armitron Sport Womens Digital 45/7086 Watch
mazon.com : Womens Wrist Watches,Nine West Womens Strap Watch
mazon.com : Womens Wrist Watches,Armitron Womens 75/2475 Watch
mazon.com : Womens Wrist Watches,Fossil Carlie Mini Womens Watch
mazon.com : Womens Wrist Watches,Womens Weekender
mazon.com : Womens Wrist Watches,Michael Kors Pyper Three-Hand Stainless Steel Watch
mazon.com : Womens Wrist Watches,Nine West Womens Bracelet Watch
mazon.com : Womens Wrist Watches,Nine West Womens Bracelet Watch
mazon.com : Womens Wrist Watches,Womens Ironman Essential 34mm Watch
mazon.com : Womens Wrist Watches,Womens TW4B11900 Expedition Field Mini
mazon.com : Womens Wrist Watches,Nine West Womens Mesh Bracelet Watch
mazon.com : Womens Wrist Watches,Casio Womens LA670WGA-9 Gold Digital Quartz Watch
mazon.com : Womens Wrist Watches,Anne Klein Womens Genuine Diamond Dial Bangle Watch
mazon.com : Womens Wrist Watches,OLEVS Womens Analog Quartz Watch with Calendar
mazon.com : Womens Wrist Watches,Michael Kors Womens Bradshaw Stainless Steel Watch
mazon.com : Womens Wrist Watches,Womens Ironman Transit 33mm Resin Strap Watch
mazon.com : Womens Wrist Watches,Anne Klein Womens Date Function Bracelet Watch
mazon.com : Womens Wrist Watches,Womens T29291 Porter Street
mazon.com : Womens Wrist Watches,Armitron Womens Bracelet Watch 75/3313
mazon.com : Womens Wrist Watches,OLEVS Analog Watch
mazon.com : Womens Wrist Watches,Womens Freja Stainless Steel Dress Quartz Watch
mazon.com : Womens Wrist Watches,Nine West Womens Floral Dial Strap Watch
mazon.com : Womens Wrist Watches,Nine West Womens Bracelet Watch
mazon.com : Womens Wrist Watches,Watches for Women 3ATM Waterproof Outdoor Digital Sport Watches Stopwatch Wrist Watch with Alarm Clock Gifts for Women/Girls
mazon.com : Womens Wrist Watches,Anne Klein Womens Watch
mazon.com : Womens Wrist Watches,Nine West Womens Strap Watch
mazon.com : Womens Wrist Watches,OLEVS Womens Analog Quartz Luminous Date Watch
mazon.com : Womens Wrist Watches,Nine West Womens Bracelet Watch
mazon.com : Personal Makeup Mirrors,Makeup Mirror Vanity Mirror with Lights 2X 3X 10X Magnification Lighted Makeup Mirror Touch Control Trifold Makeup Mirror Dual Power Supply Portable LED Makeup Mirror Women Gift (White)
mazon.com : Personal Makeup Mirrors,Lighted Makeup Mirror 8 Rechargeable Double Sided Magnifying Mirror with 3 Colors 1x/10x 360° Rotation Touch Screen Vanity Mirror Brightness Adjustable Magnification Cosmetic Light up Mirror
mazon.com : Personal Makeup Mirrors,ESWU Travel Makeup Mirror with Light Portable Folding Make Up Tabletop Mirror with 58 LEDs 3 Colors Light Modes Rechargable Compact Vanity Mirror with Adjustable Stand (Black)
mazon.com : Personal Makeup Mirrors,VESAUR Professional 8.5 Large Lighted Makeup Mirror Updated with 3 Color Lights 1X/10X Magnifying Swivel Vanity Brightness Dimmable Cosmetic Mirror with 48 Premium LED Lights Senior Pearl Nickel
mazon.com : Personal Makeup Mirrors,Vierose Vanity Mirror with Lights Hollywood Mirror with Lights &amp; 7 LED Dimmable Bulbs 13-inch Makeup Mirror with Smart Touch Control &amp; 3 Color Lighting 360° Rotation for Bedroom &amp; Dressing（White）
mazon.com : Personal Makeup Mirrors,ROLOVE 8x10 Lighted Vanity Mirror Makeup Mirror with Lights Dimmable Touch Screen Portable Travel Mirror with U-Shaped Bracket Cosmetic Mirror with Lights for Makeup Desk ＆ Dressing Room
mazon.com : Personal Makeup Mirrors,VESAUR 8 Lighted Makeup Mirror Rechargeable 1X/10X Double Sided Magnifying Vanity Mirror with 3 Colors Light LED Dimmable Cosmetic Mirror 360°Rotation Detachable Base for Travel Senior Nickel
mazon.com : Personal Makeup Mirrors,Makeup Mirror with 10X Magnifying Mirror 3 Color Lighting 72 LEDs Vanity Mirror with Lights Lighted Makeup Mirror 10x 3X 2X Magnification Touch Control Dual Power Supply Gift for Her(Rose Gold)
mazon.com : Personal Makeup Mirrors,Fancii LED Lighted 10X Magnifying Makeup Mirror Rechargeable - 3 Dimmable Tri-Color Light Settings Suction Vanity Mirror Metallic Finish Cordless Travel Bathroom Mirror - Lana (Chrome)
mazon.com : Personal Makeup Mirrors,DECLUTTR 9 Inch Wall Mounted Lighted Makeup Mirror Double-Sided Magnifying Mirror 1x/10x 3 Colors Lighted Makeup Mirror Touch Dimmable 360° Rotation Foldable Light Up Mirror Bronze
mazon.com : Personal Makeup Mirrors,ALHAKIN Lighted Makeup Mirror 10x Makeup Mirror with Lights 7 Inch Double Sided Magnifying Vanity Mirror with 3 Color LED Dimmable Desk Lit Cosmetic Mirror Chrome
mazon.com : Personal Makeup Mirrors,Hasipu Vanity Mirror with Lights 32 x 24 Makeup Mirror Light up Mirror with 14 Dimmable LED Lights and 10X Magnification 3 Colors Modes Touch Control USB Charging Port Black
mazon.com : Personal Makeup Mirrors,Hansong Vanity Mirror with Lights Lighted Makeup Mirror with 9 LED Bulbs Plug in Light Up Makeup Mirror with Lights 360 Rotation with 10x Magnifying Mirror Tabletop
mazon.com : Personal Makeup Mirrors,CLSEVXY Vanity Mirror Makeup Mirror with Stand 1X/15X Magnification Double Sided 360 Degree Swivel Magnifying Mirror 6.25 Inch Portable Table Desk Counter top Mirror Bathroom Shaving Mirror
mazon.com : Personal Makeup Mirrors,Hansong Vanity Mirror with Lights 22x18 Hollywood Mirror Makeup Mirror with 15 Dimmable Bulbs 10X Magnification and USB Charging Port White
mazon.com : Personal Makeup Mirrors,Anfauny 8.5 Rechargeable Lighted Height Adjustable Makeup Mirror with 3 Light Colors Dimmable Double-Sided 1X/10X Magnification LED Vanity Mirror 360° Rotation Tabletop Standing Mirror – Black
mazon.com : Personal Makeup Mirrors,ROLOVE Vanity Mirror with Lights Hollywood Makeup Mirror with Light Lighted Tabletop Makeup Mirror with 4 Dimmable LED Bulbs Portable Travel Makeup Mirror with U-Shaped Bracket Smart Touch Control
mazon.com : Personal Makeup Mirrors,B Beauty Planet Magnifying Mirror with Light 20X/1X Double Sided Tabletop Mirror with Adjustable Folding Handle Cosmetic Mirror for Makeup/Travel Tweezing and Blackhead/Blemish Removal.
mazon.com : Personal Makeup Mirrors,Hasipu Vanity Mirror with Lights 22 x 18 Hollywood Lighted Makeup Mirror with 15 Dimmable Bulbs 10X Magnification and USB Charging Port Smart Touch 3 Colors Dimmable 360° Rotation (Square)
mazon.com : Personal Makeup Mirrors,IBRIGHTSO Vanity Mirror with Lights Hollywood Makeup Mirror with Lights Touch Control 3 Color Lighting Modes Dimmable Detachable 10X Magnification Mirror 360° Rotation (16in White)
mazon.com : Personal Makeup Mirrors,FUNTOUCH Rechargeable Travel Makeup Mirror with 72 Led Lights Portable Lighted Beauty Mirror 3 Color Lighting Dimmable Touch Screen Tabletop LED Folding Cosmetic Vanity Mirror
mazon.com : Personal Makeup Mirrors,CLSEVXY Magnifying Handheld Mirror Double Sided 1X 15X Magnification Hand Mirror Travel Folding Held Adjustable Rotation Pedestal Makeup Desk Vanity
mazon.com : Personal Makeup Mirrors,DECLUTTR Rechargeable Wall Mounted Makeup Mirror 8 Inch 1X/10X Magnifying Mirror with 3 Color Lights Dimmable LED Lighted Makeup Mirror with Double Sided Chrome
mazon.com : Personal Makeup Mirrors,B Beauty Planet 30X Magnifying Mirror Two Sided Mirror 30X/1X Magnification Folding Makeup Mirror with Handheld/Stand Use for Makeup Application Tweezing and Blackhead/Blemish Removal. 5IN.
mazon.com : Personal Makeup Mirrors,DECLUTTR Vanity Mirror with Lights Hollywood Makeup Mirror with Lights Phone Holder Smart Touch Control 3 Color Lighting Modes with Detachable 10x Magnification Mirror 360°Rotation White
mazon.com : Personal Makeup Mirrors,Gvnkvn Makeup Vanity Mirror with Lights 32 x 24 Large LED Makeup Mirror Light up Mirror with 10X Magnification and USB Charging Port Dimmable 3 Modes Touch Screen Control Square Corner
mazon.com : Personal Makeup Mirrors,COSMIRROR Lighted Makeup Vanity Mirror with 10X Magnifying Mirror 21 LED Lighted Mirror with Touch Sensor Dimming 180°Adjustable Rotation Dual Power Supply Portable Cosmetic Mirror (White)
mazon.com : Personal Makeup Mirrors,LilyHome Vanity/Makeup Mirror with Lights 10X Magnification Large Hollywood Lighted Vanity Mirror with 15 Dimmable LED Bulbs 3 Color Modes Touch Control for Bedroom Tabletop or Wall-Mounted
mazon.com : Personal Makeup Mirrors,JERDON Lighted Tabletop Makeup Mirror - Halo Lighted Makeup Mirror with 1X and 8X Magnification in Black - 8.5-Inch Diameter Vanity Mirror - Model HL8808BKL
mazon.com : Personal Makeup Mirrors,BWLLNI Lighted Makeup Mirror Hollywood Mirror Vanity Mirror with Lights Touch Control Design 3 Colors Dimable LED Bulbs Detachable 10X Magnification 360°Rotation White.
mazon.com : Personal Makeup Mirrors,Flymiro Tri-fold Lighted Vanity Makeup Mirror with 3x/2x Magnification 21 LEDs Light and Touch Screen 180 Degree Free Rotation Countertop Cosmetic Mirror Travel (Rose Gold)
mazon.com : Personal Makeup Mirrors,Filytop 22.8x 18.1 Makeup Mirror with Lights 10X Large Hollywood Lighted Vanity Mirror with 15 Dimmable LED Bulbs 3 Color Modes Touch Control Tabletop or Wall-Mounted White
mazon.com : Personal Makeup Mirrors,Makeup Mirror with Lights - 3 Color Lighting Modes 60 Led Lighted Cosmetic Mirror 1x 5X 7X Magnification Touch Screen 90 Degree Adjustable Rotation Dual Power Supply Portable Trifold Mirror
mazon.com : Personal Makeup Mirrors,LOTIKO Vanity Makeup Mirror with Natural Wooden Stand 6 Inch Single Sided 360 Degree Swivel Mirror Portable Table Desk Countertop Mirror Standing Mirror for Desk(Square)
mazon.com : Personal Makeup Mirrors,Make up Mirrors Lighted Magnifying Stand up 1x/2x/3x Mirror With Lights For Vanity Desk Foldable LED Beauty Mirror With 3 Color Lighting Modes Touch Control Portable for Personal Mirrors White
mazon.com : Personal Makeup Mirrors,Travel Makeup Mirror with 10X Magnifying Mirror Vanity Mirror with 80LEDs 3 Color Lighting Rechargeable 2000mAh Batteries Portable Ultra Slim Lighted Makeup Mirror Travel Essential for Women
mazon.com : Personal Makeup Mirrors,LOVESPEJO 9Lighted Makeup Mirror with Magnification 1X/7X Magnifying Mirror Rechargeable Double Sided LED Oval Makeup Mirrors 3 Colors Dimmable Vanity Mirror，360°Rotation Cosmetic Mirror Chrome
mazon.com : Personal Makeup Mirrors,ESWU Travel Makeup Mirror with Light Portable Folding Make Up Tabletop Mirror with 58 LEDs 3 Colors Light Modes Rechargable Compact Vanity Mirror with Adjustable Stand (Black)
mazon.com : Personal Makeup Mirrors,Facegra Lighted Makeup Mirror with Magnification: 10X Magnifying Mirror with 2000mAh Rechargeable Battery Portable Mirror Travel Accessories Essentials Stuff for Women Upgraded
mazon.com : Personal Makeup Mirrors,LANSI Rechargeable Wall Mounted Lighted Makeup Mirror Mounted Makeup Magnifying Mirror with Lights 10X LED Vanity Mirror Wall Mounted 8 Wall Bathroom Light Up Magnified Mirror (Black)
mazon.com : Personal Makeup Mirrors,Rocollos Upgraded Base Version Rechargeable Wall Mounted Lighted Makeup Mirror Chrome with 3 Color Lights Dimmable Touch Screen 8 Inch LED Double Sided 1X/10X Magnifying 360°Swivel 13 Inch Retractable
mazon.com : Personal Makeup Mirrors,EASEHOLD Makeup Mirror with Lights 2X 3X Magnification Lighted Makeup Mirror Rechargable 2000mAh Mirror Vanity Mirror with 64 Led Lights 3 Color Lights Touch Screen Light Up Mirror for Tabletop
mazon.com : Outdoor Rugs,GENIMO Outdoor Rug 5 x 8 Waterproof for Patios Clearance Reversible Plastic Straw Camping Carpet Large Area Rugs Mats for RV Picnic Backyard Deck Balcony Porch Beach Grey&amp;White
mazon.com : Outdoor Rugs,Nourison Aloha Indoor/Outdoor Area Rug 5 3 x 7 5 Multi Color Rectangular 0.25 Thick Tropical Botanical Easy-Cleaning Non Shedding Bed Room Living Room Dining Room Deck Backyard Patio
mazon.com,JOYIN Kids Play Rugs - 12 Pull-Back Vehicle Set - Durable Carpet Playmat Rug - City Pretend Play - Toddler Car Track Rug
mazon.com,JOYIN Carpet Playmat w/ 12 Cars Pull-Back Vehicle Set for Kids Age 3+ Jumbo Play Room Rug City Pretend Play
mazon.com,Melissa &amp; Doug Hop &amp; Count Hopscotch Rug (Play Space &amp; Room Decor Skid-Proof Backing 27” H x 5.5” W x 5.5” L) - Classic Hopscotch Rug For Kids
mazon.com,IKITOT Kid Rug Carpet Playmat for Toy Cars and Train，Play Area Rug with Rubber Backing，Fun Throw Rug，Ideal Gift for Children Baby Bedroom Play Room(80×120cm/32×47in)
mazon.com,Melissa &amp; Doug Round the Town Road Rug and Car Activity Play Set With 4 Wooden Cars (39 x 36 inches)
mazon.com,Light Up Fried Cat Rug Funny Aunt Bethany’s Fried Pussycat Rug from National Lampoon’s Humour Christmas Vacation Decoration Carpet Perfect White Elephant Gift for Family Friends (Color Light)
mazon.com : Area Rugs,SAFAVIEH Adirondack Collection Area Rug - 9 x 12 Ivory &amp; Silver Oriental Distressed Design Non-Shedding &amp; Easy Care Ideal for High Traffic Areas in Living Room Bedroom (ADR109C)
mazon.com : Area Rugs,SAFAVIEH Madison Collection Area Rug - 8 x 10 Grey &amp; Pink Modern Abstract Design Non-Shedding &amp; Easy Care Ideal for High Traffic Areas in Living Room Bedroom (MAD460A)
mazon.com : Area Rugs,SAFAVIEH Reflection Collection Area Rug - 8 x 10 Beige &amp; Cream Vintage Distressed Design Non-Shedding &amp; Easy Care Ideal for High Traffic Areas in Living Room Bedroom (RFT670A)
mazon.com : Area Rugs,SAFAVIEH Monaco Collection Area Rug - 8 x 10 Forest Green &amp; Light Blue Boho Medallion Distressed Design Non-Shedding &amp; Easy Care Ideal for High Traffic Areas in Living Room Bedroom (MNC243F)
mazon.com : Crib Sheets,Biloban Crib Sheets for Boys Fitted Crib Sheet for Standard Crib Mattress 2 Pack Neutral Toddler Sheets for Boys Machine Washable Microfiber Grey &amp; Navy
mazon.com : Crib Sheets,Everyday Kids 2-Pack Fitted Crib Sheets 100% Soft Breathable Microfiber Baby Sheet Fits Standard Size Mattress 28in x 52in Lavender Pink Nursery Sheet
mazon.com : Crib Sheets,TILLYOU Fitted Crib Sheet Set 2 Pack - Super Soft Toddler Bed Sheets for Standard Crib and Toddler Mattresses 28x52x8 White &amp; Gray
mazon.com : Crib Sheets,GROW WILD Unicorn Crib Sheets 3 Pack - Soft &amp; Stretchy Jersey Cotton Fitted Baby Crib Sheets for Girls White Pink Purple Toddler Bed Sheets - Cute Crib Sheets for Baby Girl - Crib Sheets Girl
mazon.com : Crib Sheets,Yoofoss Baby Crib Sheets for Boys Girls Fitted Crib Sheet 2 Pack for Standard Crib and Toddler Mattress Super Soft Microfiber Baby Sheet 28x52x8in(Green+Leaf)
mazon.com : Crib Sheets,2-Pack Organic Crib Sheets for Boys Girls - Jersey Fitted Crib Sheet Baby Crib Sheets Neutral Crib Mattress Sheet Cotton Crib Sheets Soft Baby Sheets for Crib (Woodland)
mazon.com : Crib Sheets,Crib Sheets for Boys and Girls 4 Pack Fitted Crib Sheet for Standard Size Crib and Toddler Mattresses Breathable &amp; Soft Microfiber Toddler Sheets for Baby Gift Grey/Navy/White
mazon.com : Crib Sheets,Burts Bees Baby - Fitted Crib Sheet Boys &amp; Unisex 100% Organic Cotton Crib Sheet for Standard Crib and Toddler Mattresses (Hello Moon!) 28x52 Inch (Pack of 1)
mazon.com : Crib Sheets,2-Pack Bamboo Viscose Crib Sheets for Boys Girls Unisex - Organic Fitted Crib Sheet Neutral Crib Mattress Sheet Toddler Bed Sheets for Crib (Khaki)
mazon.com : Crib Sheets,Premium Fitted Baby Boy Crib Sheets for Standard Crib Mattress - Ultra-Soft Jersey Knit Crib Mattress Sheet Safe and Snug Durable Stylish Crib Sheet 28x52x9 Extra Deep Pocket
mazon.com : Crib Sheets,The Peanutshell Fitted Crib Sheet Set for Baby Boys or Girls | Zoo Animals and Tribal Stripes | Unisex 2 Pack Set
mazon.com : Crib Sheets,PHF Soft Fitted Crib Sheet Set 2 Pack Silky Comfy Breathable Baby Sheets for Boys Girls 28x52x8 Inch Fits Standard Crib and Toddler Mattresses Light Grey &amp; Light Grey
mazon.com : Crib Sheets,Stretch Ultra Soft Jersey Knit Fitted Crib Sheets Set 2 Pack Fits All Standard Crib Mattress Pads Safe and Snug Crib Fitted Sheet for Baby Jungle Bear/Rainbow for Baby
mazon.com : Crib Sheets,Crib Sheets for Boys or Girls 2 Pack Fitted Crib Sheet for Standard Size Crib and Toddler Mattresses Soft and Breathable Material Grey &amp; Navy
mazon.com : Crib Sheets,Stretchy Crib Sheets for Boys Girls 2 Pack Baby Crib Sheets Fitted for Standard Crib and Toddler Bed Mattress 52 x 28 Soft and Breathable Fitted Crib Sheets Neutral Grey
mazon.com : Crib Sheets,Crib Mattress Protector 2 Pack Pad Waterproof Quilted Crib Mattress Cover Sheets Fitted Absorbent &amp; Noiseless Mattress Protector Fit Baby Toddler Bed Mattress Pad (Standard Size 52” x 28”)
mazon.com : Crib Sheets,Crib Sheets for Boys or Girls 4 Pack Baby Crib Sheets 52 x 28 for Standard Crib &amp; Toddler Mattress Soft and Breathable Material Baby Crib Sheets Neutral Grey Dinosaurs &amp; Ocean
mazon.com : Crib Sheets,Muslin Crib Sheets Cotton Neutral Crib Sheet for Baby Girls and Boys Fitted for Standard Crib Mattress &amp; Toddler Bed Mattress (52x28) Soft and Breathable 2 Pack(Monstera Leaves&amp;Dark Green)
mazon.com : Crib Sheets,Carters Pink Giraffe &amp; Hearts 100% Cotton Sateen 2 Pack Fitted Crib Sheets Pink White
mazon.com : Crib Sheets,Muslin Crib Sheets for Girls and Boys Cotton Boho Neutral Fitted Baby Crib Sheet for Standard Crib Mattress &amp; Toddler Bed Mattress (52x28) Soft Breathable Baby Sheets 2 Pack (Sunshine&amp;Brown)
mazon.com : Crib Sheets,The Peanutshell Fitted Crib Sheets Set Unisex 4 Pack Celestial Print Grey Moon &amp; Stars
mazon.com : Crib Sheets,Burts Bees Baby - Fitted Crib Sheet Solid Color 100% Organic Cotton Crib Sheet for Standard Crib and Toddler Mattresses (Cloud White)
mazon.com : Crib Sheets,The Peanutshell Fitted Crib Sheet Set for Baby Boys or Girls | Unisex 4 Pack Set | Cactus Succulents &amp; Pastel Green
