Category_Names,Product_Names
mazon.com : Home Cabinet Accessories,Simple Houseware Over The Cabinet Door Organizer Holder Silver
mazon.com : Home Cabinet Accessories,oylik Expanadable Foil and Plastic Wrap organizer 3 Tier Stackable Kitchen Cabinet Pantry Storage Shelf Height Adjustable Kitchen Organizers and Storage Rack Boxes of Foil Plastic Saran Wrap
mazon.com : Home Cabinet Accessories,ORLESS 2-Pack Kitchen Cabinet Door Organizer Over Cabinet Door Organizer with Towel Bars Cabinet Door Storage for Cutting Board Foil Plastic Wrap Baking Sheet Cookie Sheet Black
mazon.com : Home Cabinet Accessories,Under Sink Organizer Pull Out Cabinet Organizer 2 Tier Slide Out Sink Shelf Cabinet Storage Shelves Under Sink Storage for Kitchen Bathroom Cabinet
mazon.com : Home Cabinet Accessories,Redrubbit Medium (13 x 9. 4 Inch) Cabinet Storage Shelf Rack Rustproof Kitchen Counter and Cabinet Shelf Storage Rack Organizer for Kitchen Fridge Cabinet Bathroom Set of 2
mazon.com : Home Cabinet Accessories,4 Tier Stackable Water Bottle Organizer for Cabinet - Premium Clear Holder for Tumbler Cup Travel Mug Wine Rack Display - Home Kitchen Pantry Refrigerator Organization and Storage - Hold 12 Bottles
mazon.com : Home Cabinet Accessories,Courpal 144 Pcs Minimalist Laundry Room Labels Set Water Resistant Stickers Water/Oil Resistant Stickers for Laundry Room Linen Closet Home Bathroom and The Beauty Organization
mazon.com : Home Cabinet Accessories,Masirs Kitchen Cabinet Organizer Set Three Shelves Two Under Shelf Baskets Additional Cabinet or Counter Storage Space to Organize your Dishes Glasses and Food Items (5-Piece Set)
mazon.com : Home Cabinet Accessories,Evelots Wire Rack Cabinet Shelf Organizer Set of 2 White Kitchen Organization Bathroom Cabinet Organizer Food Pantry Organization and Storage Shelves
mazon.com : Home Cabinet Accessories,Kigley 6 Pcs Wood Pegboard Drawer Organizer with 48 Pegs Wood Peg Board System Peg Drawer Organizers for Dishes Wooden Drawer Plate Organizer Kitchen Pegboard for Food Containers Cookware (Wood Color)
mazon.com : Home Cabinet Accessories,STORAGE MANIAC Set of 4 Expandable Kitchen Rack Wire Shelf Organizer Kitchen Organization Adjustable Metal Pantry Storage Plate Dish Organizer for Cabinets Shelf Kitchen Counter Organizer Brown
mazon.com : Home Cabinet Accessories,Joseph Joseph CupboardStore Rotating Organizer Small Grey
mazon.com : Home Cabinet Accessories,Honey-Can-Do Stacking Cabinet Organizer SHF-09469 Chrome 400 lbs
mazon.com : Home Cabinet Accessories,VZINO Over The Cabinet Door Organizer 2 Packs Cutting Board Organizer with Towel Bar/Paper Holder for Kitchen Storage Black
mazon.com : Home Cabinet Accessories,JBESUHI Large (16.1 x 10.2 Inch) Cabinet Storage Shelf Rack Kitchen Shelves，Kitchen Counter and Cabinet Shelf Storage Rack Organizer for Kitchen Fridge Cabinet Bathroom Cupboard (White 4)
mazon.com : Home Cabinet Accessories,GEDLIRE Kitchen Cabinet Shelf Organizer Set of 2 Large (15.7 x 9.4 inch) Metal Wire Pantry Storage Shelves Dish Plate Racks for Cabinets Freezer Counter Cupboard Organizers and Storage Chrome
mazon.com : Home Cabinet Accessories,vacane Under Shelf Drawer Pull Out Under Cabinet Organizer Cupboard Storage Organizer Easy to Install Durable Plastic Storage Organizer for Kitchen Pantry Cabinet Accessories
mazon.com : Home Cabinet Accessories,mDesign Metal Wire Kitchen Bakeware Organizer Basket - Hang Over Cabinet Door - Storage for Baking Sheets Cupcake Tins Cutting Boards Foil or Plastic Wrap - Concerto Collection - Matte Satin
mazon.com : Home Cabinet Accessories,Joseph Joseph CupboardStore Under Shelf Drawer Kitchen Cupboard Storage Organizer Space Saving Gray/ White
mazon.com : Home Cabinet Accessories,GEDLIRE Kitchen Cabinet Shelf Organizer Set of 5 Large (15.7 x 9.4 inch) Metal Wire Pantry Storage Shelves Dish Plate Racks for Cabinets Freezer Counter Cupboard Organizers and Storage White
mazon.com : Home Cabinet Accessories,EDNA HOME Cabinet Shelf Organizer Elegant Stacking Cabinet Rack 5.5in x 11.8in Sturdy Plastic Pantry and Counter Shelf for Kitchen Closet Bathroom Bedroom Office Made in Europe 1-Pack Small
mazon.com : Home Cabinet Accessories,2Pcs Concealed Cabinet Hanger Universal Cupboard Wall Brackets Unit Heavy Duty Kitchen Wall Unit Cabinet Plates for Kitchen Bedroom Dinining Room Study
mazon.com : Home Cabinet Accessories,YouCopia UpSpace Water Bottle and Travel Mug Cabinet Organizer Adjustable Storage Rack for Kitchen Organization 3-Shelf
mazon.com : Home Cabinet Accessories,3 Pack Over The Cabinet Door Organizer Over Doors Wall Mounted Hanging Baskets Organizing for Cutting Board Foils Cookie Sheet and Plate Metal Storage Holder Rack for Kitchen Bathroom Pantry …
mazon.com : Home Cabinet Accessories,GEDLIRE Kitchen Cabinet Shelf Organizer Set of 6 Medium (13 x 9.4 inch) Metal Wire Pantry Storage Shelves Dish Plate Racks for Cabinets Freezer Counter Cupboard Organizers and Storage Chrome
mazon.com : Home Cabinet Accessories,Under Sink Organizer Pull Out Cabinet Organizer 2 Tier Slide Out Sink Shelf Cabinet Storage Shelves Under Sink Storage for Kitchen Bathroom Cabinet
mazon.com,Gosmol Silicone Sponge Holder Rack Dish Soap Holder for Kitchen Counter Waterproof Sponge Soap Tray for Kitchen Sink Bathroom Multipurpose Sink Caddy Organizer for Soap Dispenser Black
mazon.com,mDesign Metal Wire Food Storage Basket Organizer with Front Dip Opening for Organizing Kitchen Cabinets Pantry Shelf Bathroom Laundry Room Closet Garage Concerto Collection 2 Pack - Matte Black
mazon.com,Prosumers Choice Bamboo Storage Box - Bamboo Box Storage for Kitchen Living Room Bathroom Office - Arts &amp; Crafts Container Caddy Basket - Home Decor &amp; Organization Accessories 14L x 11W x 6H
mazon.com,HOOJO Refrigerator Organizer Bins - 8pcs Clear Plastic Bins For Fridge Freezer Kitchen Cabinet Pantry Organization BPA Free Fridge Organizer 12.5 Long Clear
mazon.com,iDesign Gia Stainless Steel Dish Sponge Holder Basket with Suction Cups Ideal for Kitchen Sinks and Bathroom Organization Set of 1 Polished
mazon.com,ClearSpace Plastic Storage Bins – Perfect Kitchen Organization or Pantry Storage – Fridge Organizer Pantry Organization and Storage Bins Cabinet Organizers
mazon.com,YIHONG Clear Pantry Storage Organizer Bins 6 Pack Plastic Storage Containers with Handle for Kitchen Refrigerator Freezer Cabinet Closet Bathroom Under Sink Organization
mazon.com,SunnyPoint NeverRust Deluxe Kitchen Sink Suction Holder for Sponges Scrubbers Soap Kitchen Bathroom 304 Stainless Steel (Brushed Texture 7.4 x 3.3 x 2.75 Inch)(Sponge &amp; Brush NOT Included)
mazon.com,Vtopmart 6 Pack Clear Stackable Storage Bins with Lids Large Plastic Containers with Handle for Pantry Organization and Storage Perfect for Kitchen Fridge Cabinet Bathroom Organizer
mazon.com,9Pack Large Chip Bag Clips - Assorted Sizes Food Bag Clips Plastic Heavy Seal Grip
mazon.com,Vtopmart 4 Pack Food Storage Organizer Bins Clear Plastic Bins for Pantry Kitchen Fridge Cabinet Organization and Storage Compartment Holder Packets Snacks Pouches Spice Packets
mazon.com,SpaceAid WrapNeat 3 in 1 Wrap Organizer with Cutter and Labels Plastic Wrap Aluminum Foil and Wax Bamboo Dispenser for Kitchen Storage Organization Holder for 12 Roll (Natural)
mazon.com,EsLuker.ly Universal Stainless Steel Microwave Oven Wall Mount Bracket with Removable Hooks Arm Adjustable Foldable Kitchen Stretch Oven Stand Shelf Rack Load 100 lb
mazon.com,SHINOSKE 6-Layer Over the Door Pantry Organizer with 6 Baskets - Adjustable Pantry Door Organizer for Perfect Storage in Pantry Bedroom Bathroom or Kitchen - White-Over the Door Spice Rack Included
mazon.com,Vtopmart 4 Pack Large Clear Plastic Storage Bins with Lids Stackable Containers with Handle for Pantry Kitchen Fridge Cabinet Bathroom Under Sink Organizer Includes Labels (XL)
mazon.com,Utopia Home - Fridge Organizer Bins - Set of 8 Refrigerator Organizer Set - Pantry Organizers and Storage - Clear Storage Bins For Fridge Organization and Storage - Home &amp; Kitchen Organization
mazon.com,SunnyPoint NeverRust Kitchen Sink Suction Holder for Sponges Scrubbers Soap Kitchen Bathroom 6 x 2.5 x 2.75 Aluminum (Black 1)
mazon.com,Vtopmart Clear Plastic Pantry Organizer Bins 6 PCS Food Storage Bins with Handle for Refrigerator Fridge Cabinet Kitchen Countertops Cupboard Freezer Organization BPA Free Medium
mazon.com,Baggy Rack Holder For Food Prep Bag/plastic Freezer Bag/Ziplock Bag Holder Stand Meal Planning/prep Bag Holders 4 Pack/4pcs
mazon.com,HLOOL Sponge Holder for Kitchen Sink Kitchen Sink Sponge Holder Kitchen Sink Caddy Dish Sponge Holder Silver
mazon.com,ClearSpace Plastic Storage Bins With lids – Perfect Kitchen Organization or Pantry Storage – Fridge Organizer Cabinet Organizers - 4 Pack
mazon.com,ZIJUND Water Bottle Organizer for Cabinet 2 Pack Stackable Plastic Water Bottle Holder Wine Racks for Kitchen Pantry Organization and Storage Holds 8 Bottles Countertop Clear
mazon.com,[ 12 Pack ] Multi-Use Clear Bins for Organizing - Fridge Refrigerator Organizer Bins - Pantry Organization and Storage - Plastic Containers for Home Kitchen Freezer SOHO Collection Canbinet RV
mazon.com,Cisily Sponge Holder for Kitchen Sink Sink Caddy with High Brush Holder Organzier Rustproof 304 Stainless Steel Dish Organizer Divider Soap Dispenser Storage
mazon.com,Stackable Refrigerator Organizer Bins 6 Pack Clear Kitchen Organizer Container Bins with Handles and 20 PCS Plastic Bags for Pantry Cabinets Shelves Drawer Freezer - Food Safe BPA Free 10L
mazon.com,TACGEA Chip Clips 8 Pack Food Clips Upgrade Wide Open Bag Clips for Food Storage with Air Tight Seal Grip (4 x L 4 x S)
mazon.com,Utopia Kitchen Grocery Plastic Bag Holder and Dispenser - Easy Wall Mount Bag Saver - Stainless Steel (Silver)
mazon.com,Bluapple Produce Saver Refill Kit - Keep Fruits and Vegetables Fresh Longer 8 Veggie and Fruit Saver Packets Each Packet Lasts up to 3 Months Ethylene Gas Absorber Made in USA
mazon.com,ClearSpace Plastic Pantry Organization and Storage Bins with Removable Dividers – Perfect Kitchen Organization or Kitchen Storage – Refrigerator Organizer Bins Cabinet Organizers (4 Pack)
mazon.com,Animal Shape Novelty Kitchen Sponge Holder and Sponge Choice of Frog or Duck (Green Frog)
mazon.com,Virvia Microwave Stand Expandable Microwave Oven Rack Adjustable Thickened Stainless Steel 2-Tier Kitchen Countertop Organizer Shelf with 4 Hooks for Kitchen Supplies Tableware Storage
mazon.com,Bamboo 9 in 1 Ziplock Bag Aluminum Foil and Plastic Wrap Organizer for Drawer
mazon.com,BEKU Coffee Bar Accessories Kitchen Decor - Wooden Station Countertop Organizer - Condiment Caddy Set up Box - Rustic Storage Basket with Handle - Coffe Farmhouse K cup Storage - Pods Holder (Brown)
mazon.com : Cabinet Door Organizers,Cabinet Door Organizer Cutting Board Organizer 2 Pack Kitchen Cabinet Door Organizer with Towel Bars Over The Cabinet Door Organizer Kitchen Cabinet Organizers and Storage Cutting Board Holder
mazon.com : Cabinet Door Organizers,Over the Cabinet Door Organizer 2 Pack Cutting Board Organizer Kitchen Cabinet Organizer Over the Door Pantry Organizer Kitchen Organizer Cutting Board holder Over Cabinet Towel Bar Foil Organizer
mazon.com : Cabinet Door Organizers,NiHome Cabinet Door Lid Organizer 2-Pack Cabinet Organizers and Storage Compact Design for Space Optimization-Over the Cabinet Door Organizer for Diverse Storage Solution
mazon.com : Cabinet Door Organizers,Shengsite Over the Door Pantry Organizer 4+4 Tier Wall mounted Spice Rack Pantry Door Organizer with 4 Long and 4 Short Baskets Pantry Door Storage Rack for Kitchen Storage Room and Bathroom
mazon.com : Cabinet Door Organizers,Toplife Wall Door Adhesive Kitchen Wrap Organizer Rack No Drilling Black - Set of 2
mazon.com : Cabinet Door Organizers,Over the Cabinet Door Organizer 3 Pack Wall Mount Storage Basket with Name Plate for Cutting Board Foils Cookie Sheet Grid Storage Bin Basket Holder Rack with 5 S Hooks for Kitchen Pantry Bathroom
mazon.com : Cabinet Door Organizers,SPACIOR 2 Pack Over the Cabinet Door Organizer Holder with Multipurpose Hooks. Kitchen Cabinet Door Organizer and Storage for Baking Sheets Foil Wraps&amp;Cleaning Supplies - Hanging Cutting Board Holder
mazon.com : Cabinet Door Organizers,iNUREYE 2 Pack Cabinet Door Organizer Kitchen Wall Mount Storage Basket Cutting Board Organizer with Towel Bar Over The Cabinet Door Organizer with Towel Rack Black
mazon.com : Cabinet Door Organizers,Cutting Board Holder Cabinet Door Organizer Kitchen over the Door Organizer Bronze-Pack of 2
mazon.com : Cabinet Door Organizers,Rev-A-Shelf 14 in Door Storage Bins Set (White)
mazon.com : Cabinet Door Organizers,Zamfoot 2 Pack Cabinet Door Organizer Over Cabinet Door Organizer Kitchen Cabinet Door Organizer Over Cabinet Door Storage for foil Plastic wrap Baking Sheet Cutting Board bakeware Towel Holder
mazon.com : Cabinet Door Organizers,LIVOD Cabinet Door Organizer Over The Cabinet Door Organizer with Double Towel Bars Cutting Board Organizer with Towel Holder Kitchen Cabinet Organier for Baking Sheet Plastic Wrap Black
mazon.com : Cabinet Door Organizers,SimpleHouseware Over Cabinet Door Organizer Mesh Bronze
mazon.com : Cabinet Door Organizers,KES Cabinet Door Organizer with Towel Bar Cutting Board Organizer for Kitchen Over the Cabinet Door Organizer White KUR520-WH
mazon.com : Cabinet Door Organizers,mDesign Metal Wire Kitchen Bakeware Organizer Basket - Hang Over Cabinet Door - Storage for Baking Sheets Cupcake Tins Cutting Boards Foil or Plastic Wrap - Concerto Collection - Graphite Gray
mazon.com : Cabinet Door Organizers,DecoBros Over Cabinet Door Organizer Holder Silver
mazon.com : Cabinet Door Organizers,YMCCOOL 2 Pack Cabinet Door Organizer Over The Cabinet Door Organizer with Towel Bars Hang Over Cabinet Door Storage Kitchen Cabinet Door Organizer for Cutting Board Baking Sheet Foil Plastic Wrap
mazon.com : Cabinet Door Organizers,Spectrum Diversified Contempo Storage Basket Over The Cabinet Steel Wire Sink Organizer for Kitchen &amp; Bathroom Medium Chrome
mazon.com : Cabinet Door Organizers,SUINHE 2 Pack Over The Cabinet Door Organizer Kitchen Cabinet Door Organizer Over The Cabinet Cutting Board Holder Kitchen Cabinet Towel Rack with foil and Packaging Organizer
mazon.com : Cabinet Door Organizers,Johamoo Cabinet Door Organizer 2 Pack Over the Cabinet Door Organizer with Towel Bar Kitchen Cabinet Door Storage for Cutting Boards Foil and Plastic Wrap Over the Cabinet Basket Black
mazon.com : Cabinet Door Organizers,EINFAGOOD Over the Cabinet Door Organizer Holder Wall Basket No Drilling with Adhesive Pads 2 Pack Black(Door Baskets)
mazon.com : Cabinet Door Organizers,Ormeli 3 Pack Over The Cabinet Door Organizer Cabinet Door Storage for Cutting Board Kitchen Cabinet Organier for Foil Baking Sheet Plastic Wrap Storage Basket with Name Plate and 6 S Hooks
mazon.com : Cabinet Door Organizers,Qflushor Cabinet Door Organizer with Towel Bar Cutting Board Organizer with Towel Holder Over The Cabinet Door Organizer Kitchen Cabinet Organizer for Pantry Baking Sheet Plastic Wrap Black
mazon.com : Cabinet Door Organizers,COVAODQ Cabinet Door Organizer Over The Cabinet Door Organizer with Towel Bar Cutting Board Organizer Kitchen Cabinet Towel Holder (2 Pack Black)
mazon.com : Cabinet Door Organizers,Bee Home Over the Cabinet Pantry Door or Wall Mounted Heavy Duty Metal Basket Organizer Storage Rack for Kitchen Bathroom Office Toy Room includes hooks for over the door or wall mounting (5 Tier)
mazon.com : Cabinet Door Organizers,Toplife Wall Door Adhesive Kitchen Wrap Organizer Rack No Drilling Black - Set of 2
mazon.com : s,U S International Spice Box With Floral Burnt Design In Sheeham Wood-Spice Box For Kitchen Indian Wood Container With Lid Decorative Masala Dabba Organizer Spice Storage
mazon.com : s,Powder Dispenser for 1 and 2 Grams in Polished Aluminum. Discreet and Hygienic Snuff Bullet.
mazon.com : s,2 Pack Magnetic Spice Rack for Refrigerator Magnetic Refrigerator Organizer Strong Magnetic Fridge Shelf Rustproof Side Fridge Storage Rack for Kitchen
mazon.com : s,Barbie
mazon.com : s,10 Cuttable Spice Drawer Organizer Liner for Spice Drawer Spice Organizer Grey
mazon.com : s,Kitchen Cabinet Storage Shelves Organizer Set of 2 Shelf Risers for Cabinet Stackable Expandable Storage Racks with Anti-Slip Rubber Feet for Cabinet Pantry Black
mazon.com : s,Magnetic Spice Rack - 2PCS Magnetic Spice Rack New S design Strong Magnetic Shelf with four removable hooks Excellent Space Saver works as Shelf for holding spices jars Bottle.
mazon.com : s,Expandable Spice Rack 2-Tier Spice Rack Shelf Stainless Steel Seasoning Holder Inclined Seasoning Organizer Shelf Countertop Inclined Spice Holder 13.8-23.6 Adjustable with 8 Pans
mazon.com : s,Camping Spice Kit Portable Spice Bag with Spice Jars Camping Seasoning Containers Portable Spice Shaker Bottles Set with Storage Bag Easy to Carry for Home Restaurant Camping Travel(S)
mazon.com : s,Rotating Spice Rack Single Layers Spice Organizer Storage with 8 Jar Bottles Turntable Cupboard Organizer with Handle for Home Kitchen S Spice Rack with Jar Spice Organizer Spice Rack Organizer
mazon.com : s,Spice Racks Rotating Spice Rack Single Layers Spice Organizer Storage with 8 Jar Bottles Turntable Cupboard Organizer with Handle for Home Kitchen S
mazon.com : s,8pcs Portable Spice Container Spice Dispenser Bottle Leakproof Storage Bottles Mini Glass Vials with Spoon for Outdoors Travel Camping
mazon.com : s,Metal Spice Rack Shelf with Jars Wall Mount Hanging Paper Towel Holder Kitchen Organizer for Countertop Home and Kitchen Kitchen Storage Black S
mazon.com : s,Spice Shelf Cup Holder Wall Organizer Hanging Kitchen Roll Holder Without Drilling Stainless Steel Shelf for Kitchen Spice Organizer Black S
mazon.com : s,Stainless Steel Durable Spice Jar with Rotating Lids BBQ Spice Shaker Spice Storage Containers Spice Bottles Kitchen Cooking Tools for Salt Black Pepper Seasonings(S)
mazon.com : s,Magnetic Spice Rack Organizer for Refrigerator 4 Pack Moveable Strong Magnet Spice Shelf Kitchen Super Magnetic Shelves for Saving Space Black.
mazon.com : s,Metal Countertop Shelf Organizer Storage Rack Multifunction Pantry Storage Organizer Kitchen Spice Rack Bathroom Shelf Organizer Tabletop Shelf Book Shelf (S)
mazon.com : s,4pcs Bathroom Rotating Rack Compartment Supply for Organizing Countertop Makeup Desk Kitchen Clear Pantry Organizer S Accessories Vanity Cabinet Household Office Plastic Seasoning
mazon.com : s,Seasoning Organizer Practical Wide Application Kitchen Seasoning Bottle Storage Tray S
mazon.com : s,Species Speaking Speaking Species Species Single Layer Spices Organizer Storage with 8 Bottles of Bottle Rotating Cabinet with Mango Cuisine House s
mazon.com : s,Rotating Spice Rack Rotating Countertop Spice Carousel Tower Stand 2 Layers Spice Organizer Storage with 8 Jar Bottles Turntable Cupboard Organizer with Handle S
mazon.com : s,Microwave Storage Rack Stainless Stell Wall Mount Shelf Kitchen Storage Organiser Cabinet Spice Jar Rack Oven Holder Kitchen Commercial Shelf Rack Restaurant Bar Multifunctional Storage s/B (B
mazon.com : s,Rotating Spice Rack 1 Layers Spice Organizer Storage with 8 Jar Bottles Turntable Cupboard Organizer with Handle for Home Kitchen S
mazon.com : s,Durable Spice Rack Round Spice Rack 360-degree Turntable Multifunctional Countertop Organizer Multifunctional Storage Rack Silver S
mazon.com,Sevenblue 2 Pack Under Sink Organizer Under Bathroom Cabinet Organizer with Hooks Hanging Cup Multi-Purpose Storage Shelf for Kitchen Bathroom Black
mazon.com,REALINN Under Sink Organizer and Storage 2 Pack Pull Out Cabinet Organizer Slide Out Sink Shelf Cabinet Storage Shelves Under Sink Storage for Kitchen Bathroom Cabinet
mazon.com,Sevenblue 2 Pack Under Sink Organizers and Storage 2 Tier Sliding Bathroom organizer Multi-Use Under Kitchen Cabinet Storage Shelf (Black 2Pack)
mazon.com,2-Tier Under Sink Organizers 2 Pack Sliding L-shape Cabinet Organizers Narrow Space Storage Multi-purpose Sink Organizer for Bathroom Kitchen Drawer(Black 2 )
mazon.com,Kjfeoiye Under Sink Organizers and Storage 2 Pack Large Capacity Heavy Load Pull-out Under Sink Shelves with Sliding Drawer for Kitchen and Bathroom Black 12 x 8.7 x 15.7 inch
mazon.com,DEKAVA Under Sink Organizer 2 Pack Bathroom Cabinet Organizer 2 Tier Sliding Cabinet Basket Organizer Drawer Multi-Purpose Bath Collection Baskets for Bathroom (Black)
mazon.com,POUGNY 2PC Under Sink Organizer Rack 2 Tier Under Sliding Cabinet Basket Organizer Drawer with 4 Hooks Multi-purpose Under Sink Storage for Bathroom Kitchen Desktop（Black）
mazon.com,ARSTPEOE 2 Pack Double Sliding Under Sink Organizers and Storage Two Tier Bathroom Storage and organization Under Cabinet Organizer with Hooks Home Organization Black
mazon.com,DEKAVA Under Sink Organizer L-shaped 2 Pack Bathroom Organizer 2 Tier Sliding Cabinet Organizer Narrow Space Under Sink Organizers and Storage for Kitchen Bathroom
mazon.com,artzon 2 Pack Under Sink Organizers and Storage 2-Tier Sliding Cabinet Basket Organizer with Hooks Multi-Purpose Under Sink Organizers and Storage for Bathroom Kitchen
mazon.com,Ravinte&nbsp;2&nbsp;Pack&nbsp;Pull&nbsp;Out&nbsp;Under&nbsp;Sink&nbsp;Organizer&nbsp;2&nbsp;Tier&nbsp;Multi&nbsp;Purpose&nbsp;&nbsp;For&nbsp;Bathroom&nbsp;Kitchen&nbsp;Sink&nbsp;Storage&nbsp;Organizer&nbsp;With&nbsp;Hook&nbsp;&amp;&nbsp;Hanging&nbsp;Cup&nbsp;Matte Black&nbsp;Sliding&nbsp;Cabinet&nbsp;Organizer
mazon.com,Fkprorjv Under Sink Organizers and Storage 2 Pack Kitchen Bathroom Sink Organizer with Hooks 2 Tier Under Sink Cabinet Basket Storage Shelf with Sliding Drawers Black
mazon.com,SIKADEER Under Sink Mat for Kitchen Waterproof 34 x 22 Silicone Under Sink Liner Up to 3.3 Gallons Liquid Kitchen Bathroom Cabinet Mat-Fits Cabinets with Max Dimensions of 34 x 24
mazon.com,2 Set 2 Tier Clear Organizer with Dividers for Cabinet / Counter MultiUse Slide-Out Storage Container - Kitchen Pantry Medicine Storage Bins Bathroom Vanity Makeup Under Sink Organizing
mazon.com,HapiRm Multifunctional Sponge Holder with Unique M-Shaped Two Installation Methods Kitchen Sink Organizer Rustproof Stainless Steel Sink Caddy for Sponge Brush Sink Stopper and Scraper -Black
mazon.com,MEAFBIRD 2 Pack Under Sink Organizer 2 Tier Bathroom Cabinet Organizer with Sliding Basket Multi-Purpose Under Sink Organizers and Storage for Bathroom Kitchen
mazon.com,Cicilyna 2 Pack Under Sink Organizer 2 Tier Bathroom Cabinet Organizers and Storage with Hook Multi-purpose Storage Basket Shelf for Kitchen Black
mazon.com,Sevenblue Under Sink Organizer 3 Pack 2-Tier with Sliding Drawer Multi-Use Kitchen Organizers and Storage Bathroom Cabinet Organizer with Hook and Hanging Cup Black
mazon.com,NETEL Under Sink Organizer Expandable Cabinet Shelf Organizer 2 Tier Under Storage Rack with Removable Panels Multi-Use for Under Kitchen Bathroom Sink Organizers and Storage
mazon.com,Zyerch Under Sink Organizer Metal Pull Out Kitchen Cabinet Organizer with Sliding Drawer Sturdy Multi-Functional for Bathroom Organization Black
mazon.com,MHHA 2 Tier Clear Under Bathroom Sink Organizers and Storage Medicine Cabinet Organizer with Dividers Pull Out Kitchen Pantry Shelf Cupboard Closet Vanity Organization Bins
mazon.com,petisal 2-PACK Under Sink Organizers|Pull Out 2 Tier Slide Out Sink Shelf Cabinet Storage Shelves For Under Kitchen Bathroom (2 PACK Normal)
mazon.com,Sdpeia Under Sink Mat for Bathroom Waterproof Shelf Liner 19 x 22 in Cabinet Liner for Kitchen Under-sink Organizers Protects Cabinet from Leaks Flexible Drip Tray with Drain Hole (Grey)
mazon.com,MHHA Under Sink Mat for Kitchen Waterproof 34 × 22 Silicone Bathroom Sink Mat under sink Liner drip tray and protectors for bottom of kitchen sink Fits 36 Stand Cabinets (Grey)
mazon.com : Pull-Out Home Organizers,Under Sink Organizer Metal Large Bathroom Organizer Under Sink Pull Out Cabinet Organizer Cabinet Pull Out Shelves Pull Out Shelf for Kitchen Cabinet 2 Tier Sliding Basket Slide Out Shelf Hardware
mazon.com : Pull-Out Home Organizers,Rev-A-Shelf 2-Tier Kitchen Cabinet Pull Out Shelf and Drawer Organizer Slide Out Pantry Storage Basket in Multiple Sizes 21 x 22 In 5WB2-2122CR-1
mazon.com : Pull-Out Home Organizers,LOVMOR Single Pull Out Cabinet Organizer 31½”W x 21”D Soft Close Slide Out Drawer Storage Shelves for Kitchen Wood Cabinet Shelf Pull-Out Organizer Storage for Base Cabinet
mazon.com : Pull-Out Home Organizers,B-Land Under Sink Organizer and Storage Metal Pull Out Kitchen Cabinet Organizer with Double Sliding Drawer Multi-Purpose Cabinet Storage for Bathroom Kitchen (1 Pack)
mazon.com : Pull-Out Home Organizers,SimpleHouseware Pull Out Cabinet Sliding Basket
mazon.com : Pull-Out Home Organizers,WelFurGeer 14 Width Pull Out Drawers for Kitchen Cabinets Pull Out Cabinet Organizer Slide Out Shelves Pull Out Drawers for Pantries Slide Out Cabinet Drawers for Kitchen (14W x 21D)
mazon.com : Pull-Out Home Organizers,AHNR Pull Out Cabinet Organizer Heavy Duty Cabinet Pull Out Shelves Slide Out Cabinet Organizer Storage for Home Pull Out Drawers for Kitchen Cabinets 12.4 W x 16.5 D
mazon.com : Pull-Out Home Organizers,2 Set 2 Tier Clear Bathroom Storage Organizer with Dividers Pull Out Under Sink Organizers and Storage Multi-Purpose Cabinet Organizers and Storage for Kitchen Pantry Vanity Medicine Cabinet
mazon.com : Pull-Out Home Organizers,Stofiro 3 Tier Clear Bathroom Organizers and Storage 2 Pack Pull Out Bathroom Organizer with Dividers Multi-Purpose Cabinet Organizer for Bathroom Storage Kitchen Pantry Makeup Medicines
mazon.com : Pull-Out Home Organizers,Rev-A-Shelf Kitchen Cabinet Pull Out Shelf and Drawer Organizer Slide Out Pantry Storage Basket in Multiple Sizes 8.5 x 18 In 5WB1-0918CR-1
mazon.com : Pull-Out Home Organizers,Simple Trending Stackable 2-Tier Under Sink Cabinet Organizer with Sliding Storage Drawer Chrome
