Category_Names,Product_Names
mazon.com : Carpet Chair Mats,MIRUO Office Chair Mat for Carpet Desk Chair Mat Tempered Glass Floor Mat for Office Chair On Carpet Mat for Office Chair On Carpet (36 x 36 x 1/6 Transparent) (A-GE10018-USAM021)
mazon.com : Carpet Chair Mats,NeuType Glass Chair Mat Tempered Glass Office Chair Mat for Carpet or Hardwood Floor - Effortless Rolling Easy to Clean Best for Your Home or Office Floor (36 x 36 x 1/5 Transparent)
mazon.com : Carpet Chair Mats,Chair Mat for Carpet SALLOUS 60 x 46 Office Chair Mat for Carpeted Floors Heavy Duty Chair Mat with Grips Floor Protector Computer Desk Chair Mat for Home Office (Black Rectangular)
mazon.com : Carpet Chair Mats,Naturei Office Chair Mat for Carpeted Floor 48” x 60” Large Floor Protector Mat Easy Glide Rolling Plastic Floor Mat Desk Floor Mat for Home Office (Rectangle)
mazon.com : Carpet Chair Mats,RccugmatS Chair Mat for Hardwood &amp; Tile Floor 36 x 48 Heavy Duty Office Chair Mat for Rolling Chairs Anti Slip Non-Curve Floor Protector for Home Office Gray
mazon.com : Hard Floor Chair Mats,AiBOB Office Chair Mat for Hardwood Floors 45 X 53 in Heavy Duty Floor Mats for Computer Desk Easy Glide for Chairs Flat Without Curling Clear
mazon.com : Hard Floor Chair Mats,Kuyal Clear Chair mat for Hard Floors 36 x 48 inches Transparent Floor Mats Wood/Tile Protection Mat for Office &amp; Home (36 X 48 Rectangle)
mazon.com : Hard Floor Chair Mats,Large Office Chair Mat for Hardwood Floors - 48×60 Anti-Slip Desk Chair Mat - Heavy Duty Floor Protector for Home or Office - Easy Clean and Flat Without Curling
mazon.com : Hard Floor Chair Mats,2023 New Chair Leg Floor Protector Chair Sliders - Rubber Leg Protectors for Hardwood Floors Felt Furniture Pads Silicone Caps 32Pack Clear Medium (Fit:0.71-1.1)
mazon.com : Hard Floor Chair Mats,Placoot Office Chair Mat for Hardwood Floor 55x35 Computer Chair Mat Desk Chair Mat Large Anti-Slip Floor Protector for Home Office
mazon.com : Hard Floor Chair Mats,Chair Mat for Hard Floors Office Chair Mats for Hardwood &amp; Tile Floor Anti-Slip Floor Protector Rug Anti-Slip Dark Grey(48*36)
mazon.com : Hard Floor Chair Mats,SHAREWIN Office Chair Mat for Hardwood Floors - 36x47 Desk Chair Mats Home Floor Protector Heavy Duty - Easy Clean
mazon.com : Hard Floor Chair Mats,AiBOB Office Chair Mat for Hardwood Floors 45 X 53 in Heavy Duty Floor Mats for Computer Desk Easy Glide for Chairs Flat Without Curling
mazon.com : Hard Floor Chair Mats,QQpony Large Chair Mat for Hard Floors 63x51 Office Chair Mat for Hardwood Floors Floor Protector Chair Mat Desk Rug for Home Office (Dark Grey)
mazon.com : Hard Floor Chair Mats,Blvornl Office Chair Mat for Hard Wood Floor Durable Plastic Protector Floor Mat for Office Chair Rectangle Transparent PVC Computer Hard Floor Chair Mat for Desk Office Home (Clear 35.5 X 48in)
mazon.com : Hard Floor Chair Mats,Placoot Desk Chair Mat for Hardwood Floor &amp; Tile 55x35 Office Chair Mat for Rolling Chairs Large Anti-Slip-Recyclable Material Computer Chair Mat Rug for Office/Home
mazon.com : Hard Floor Chair Mats,Corduroy Chair Mat for Hardwood Floor 55x35 Office Chair Mat Desk Chair Mat for Rolling Chair Large Anti-Slip Backing Low-Pile Office Rug Floor Mat for Office/Home Light Grey
mazon.com : Hard Floor Chair Mats,Dimex 46x 60 Clear Rectangle Office Chair Mat For Hard Floors (1532630)
mazon.com : Hard Floor Chair Mats,Amazon Basics Vinyl Rectangular Chair Mat Protector for Hard Floors 47 x 35 inches Clear
mazon.com : Hard Floor Chair Mats,[UpgradedVersion] Crystal Clear 1/5 Thick 47 x 40 Heavy Duty Hard Chair Mat Can be Used on Carpet or Hard Floor
mazon.com : Hard Floor Chair Mats,Office Chair Mat for Hardwood Floor Aporana 36 × 47 Gaming Rolling Floor Mat Under Desk Low-Pile Rug Large Anti-Slip Multi-Purpose Hard Black
mazon.com : Hard Floor Chair Mats,Naturehydro Clear Office Chair Mat for Hardwood Floor - 48 x 30 Easy Glide Computer Desk Chair Mat on Hard Wood BPA and Phthalates Free (Rectangle)
mazon.com : Hard Floor Chair Mats,Kuyal Clear Chair Mat Hard Floor Use 48 x 30 Transparent Office Home Floor Protector mat Chairmats (30 X 48 Rectangle)
mazon.com : Hard Floor Chair Mats,Transparent Non-Slip Chair Mat Large Floor Protector Can be Used on Hardwood Floors Non-Slip Not Stuck Wheels Easy to Clean 1/7 Thick 48x36
mazon.com : Hard Floor Chair Mats,OFM Office Chair Mat for Hardwood Floor - Easy Glide Computer Desk Chair Floor Mat - Plastic Rolling Mat for Hard Floors for Work Home Gaming with Extended Lip (36” x 48”)
mazon.com : Hard Floor Chair Mats,Azadx Office Chair Mat for Hardwood Floor 30 x 48 Small Chair Mat Clear Easy Glide on Hard Floors Rolling Chair Mat Plastic Mat Under Desk Chair
mazon.com : Hard Floor Chair Mats,ECOSO Office Chair Mat for Hardwood/Tile Floor with Lip 36x 48 0.16 Thick Hard Floor Protector Anti Slip Self Adhesive and ECO Friendly Floor Mat for Office/Home. (Brown)
mazon.com : Hard Floor Chair Mats,Gorilla Grip Office Chair Mat for Carpet Floor Slip Resistant Heavy Duty Under Desk Protector Carpeted Floors No Divot Plastic Rolling Computer Mats Smooth Glide Semi Transparent Design 48x36 Clear
mazon.com : Hard Floor Chair Mats,Office Chair Mat for Hardwood Floor 63x51 Clear Office Home Floor Protector Mat Anti-Slip Desk Chair Mat Rolling Chair Mat for Office Home Gaming Easy Glide
mazon.com : Hard Floor Chair Mats,Hardwood/Tile Floor Chair Mat Rolling Chair Mat Protects Floors Suitable for Home Work Game Non-Slip Not Stuck Wheel Easy to Clean with Lip Black(48x36)
mazon.com : Hard Floor Chair Mats,Office Chair Wheels Replacement Rubber Chair Casters for Hardwood Floors and Carpet Set of 5 Stem Casters Heavy Duty Office Chair Desk Casters for Chairs to Replace Office Chair Mats - (Black)
mazon.com : Reclining Patio Chairs,Grand patio Indoor &amp; Outdoor Moor Recliner PE Wicker with Flip Table Push Back Reclining Lounge Chair Cool Grey
mazon.com : Reclining Patio Chairs,Devoko Patio Zero Gravity Chair Outdoor Folding Adjustable Reclining Chairs Pool Side Using Lawn Lounge Chair with Pillow Set of 2 (Beige)
mazon.com : Reclining Patio Chairs,KingCamp Lounge Chairs for Outside Folding Adjustable Patio Chaise Lounges for Pool Beach Sunbathing Deck Lawn Portable Heavy Duty Lay Flat Reclining Foldable Camping Cot for Outdoor with Pillow
mazon.com : Reclining Patio Chairs,Keppi Adjustable Weight Bench FoldableWorkout Bench Press for Full Body StrengthTraining Incline Decline Bench with FastFolding - 2023 Version
mazon.com : Reclining Patio Chairs,Domi Indoor &amp; Outdoor Recliner All-Weather Wicker Reclining Patio Chair Khaki Cushion (Khaki)
mazon.com : Reclining Patio Chairs,HAPPYGRILL Chaise Lounge Chair Adjustable 5-Positions Rattan Wicker Reclining Lounge with Cushion for Garden Patio Poolside
mazon.com : Reclining Patio Chairs,Grand patio Indoor &amp; Outdoor 2-Piece Reclining Chairs with Extended Footrest PE Wicker Adjustable Patio Lounge Recliner up to 150° with Flip Side Table - Mist Grey
mazon.com : ATV Cabs &amp; Roofs,Tusk UTV Fabric Roof Black For POLARIS RZR 570 2012-2021
mazon.com : ATV Cabs &amp; Roofs,HECASA Hard Top Roof Compatible with 2011-2014 Polaris Ranger 400 500 800 Mid Size 2PCS
mazon.com : ATV Cabs &amp; Roofs,Stainless Steel Clamps Mount for Polaris Roof Connector Hose Clamps Clamps Compatible with Polaris 2 Seats 900 1000 S Series Tube Holder for Pipe or Wire Cord Installation&amp; Wiring Fixing 44 pcs
mazon.com : ATV Cabs &amp; Roofs,Classic Accessories QuadGear UTV Cab Enclosure Fits Polaris Ranger 02 - 08 models Black
mazon.com : ATV Cabs &amp; Roofs,Kojem Black Soft Roof Compatible with John Deere HPX &amp; XUV Gator with OPS (Rollbar) System roof panel Replacement for LP93127
mazon.com : ATV Cabs &amp; Roofs,QYMOTO Soft Cab Enclosure Side Doors Left and Right for Hisun 500 700 Soft Doors with Zipper-open Window for Axis 500 700 Coleman 500 700 Massimo MSU500 Cab Protection
mazon.com : ATV Cabs &amp; Roofs,REARACE X3 Roof Pins Roof Quick Release Bolts Kit Compatible with 2017-2023 Can Am X3/ X3 Max- Set of 4 Replace OEM #715003815 (Black)
mazon.com : ATV Cabs &amp; Roofs,KUAFU Hard Top Roof Compatible with 2016-2019 Honda Pioneer 1000 SXS1000M3 2-Seat Model Replacement for V000012-11056Q High Density Slim Roof Top
mazon.com : ATV Cabs &amp; Roofs,Sresk RZR Shade Nets/UTV Window Net/Roll Cage Mesh Guard for Polaris RZR/ATV Cabs and Roofs (Black)
mazon.com : ATV Cabs &amp; Roofs,KEMIMOTO Upper Doors Upgrade Fit Design Compatible with Polaris RZR XP 1000 / XP Turbo RZR 900 /S 900 2014+ Upper Windows Soft Cab Enclosures New Zippers Water-resistant Side Windshield - 2 Seater
mazon.com : ATV Cabs &amp; Roofs,ECOTRIC Hard Top Compatible with 2005-2023 Kawasaki Mule 600 610 4x4 SE XC SX Roof Protector Replace for KAF600-005B
mazon.com : ATV Cabs &amp; Roofs,KEMIMOTO PRO XP 4 Soft Cab Enclosure UTV Soft Upper Door Fits with Side Mirrors and Windshields Replace 2884665 Compatible with 2020-2024 Polaris RZR PRO XP 4 2022-2024 Polaris RZR Turbo R 4
mazon.com : ATV Cabs &amp; Roofs,Polaris Premium Roof Liner
mazon.com : ATV Cabs &amp; Roofs,Falcon Ridge Soft Door Kit for Arctic Cat Prowler UTV Models with Square Roll Bars | Compatible with 2006-2011 Models
mazon.com : ATV Cabs &amp; Roofs,Classic Accessories 18-117-010401-00 Black QuadGear UTV Cab Enclosure
mazon.com : ATV Cabs &amp; Roofs,KEMIMOTO 6-Seat Crew Roof Soft Top Sunshade Airflow Net Mesh Roof Compatible with 2017-2024 Polaris Ranger Crew XP 1000/2020+ Ranger 1000 Crew/2014+ Ranger XP 900 CREW/2015-2016 Ranger XP 570 Crew
mazon.com : ATV Cabs &amp; Roofs,Roof Pins Quick Release Bolts Fits for 2017-2023 Can Am X3/X3 Max（ Replace OEM #715003815）4 Sets
mazon.com : ATV Cabs &amp; Roofs,CPOWACE Hard Top Roof for Mule 4010 2-Piece Combined Plastic Top Roof Compatible with Kawasaki Mule 1990-2021 4000 4010 3000 3010 3020 2520 2510 2500 Replace OEM #KAF30-030A
mazon.com : ATV Cabs &amp; Roofs,Seizmik UTV Framed Door Kit Compatible with Polaris Ranger 1000 XP Crew 2018-2023 Models | Polaris Door Kit | Cab Enclosure | Side by Side Accessories
mazon.com : ATV Cabs &amp; Roofs,KEMIMOTO UTV Rear Window Compatible with 2016+ pioneer 1000 2023+ Pioneer 1000-6 Roll Up/ Down Soft Rear Window/ Panel 0SR95-HL8-211B
mazon.com : ATV Cabs &amp; Roofs,Classic Accessories QuadGear UTV Cab Enclosure Fits Yamaha Rhino (with half doors - 2015 models and older) Black Medium
mazon.com : ATV Cabs &amp; Roofs,Seizmik Full Soft Doors Cab Enclosure for CF Moto UForce 1000 (2019-2021 Models) | Includes Rear Window Panel (Standard) (w/Zippered Windows)
mazon.com : ATV Cabs &amp; Roofs,HAKA TOUGH Roof Hard Top for Defender Sport 2-piece Combination Dustproof Sun Visor Roof Cover for Can Am Defender XMR HD8 HD10 Accessories 2016-2023 Replace #OEM 715002430
mazon.com : ATV Cabs &amp; Roofs,SuperATV Dark Tinted Roof for 2014+ CFMOTO UForce 800/500 | Made of 1/4 Polycarbonate | Full Visibility and Awareness | Protects from Sun Rain and Debris | Snug Rattle-Free Fit | USA Made!
mazon.com : ATV Cabs &amp; Roofs,NEVERLAND UTV Cover Heavy Waterproof Denier Oxford Cloth for Polaris RZR Yamaha Can-Am Defender Kawasaki Ranger Cover 4-6 Passenger Black
mazon.com : Office Book Racks,Vagusicc 6 Tier Tree Bookshelf - Modern Shelf Floor Standing Bookcase with Baskets Tall Wood Book Storage Rack for Books/CDs Tree Utility Book Organizer Shelves for Living Room Home Office Bedroom
mazon.com : Office Book Racks,Yoobure Tree Bookshelf - 6 Shelf Retro Floor Standing Bookcase Tall Wood Book Storage Rack for CDs/Movies/Books Utility Book Organizer Shelves for Bedroom Living Room Home Office
mazon.com : Office Book Racks,SUPEASY Desk Organizers Metal Desk Magazine File Holder with 5 Vertical Compartments Rack File Organizer for Office Desktop Home Workspace Black
mazon.com : Office Book Racks,Adjustable Bookends Metal Book Ends for Heavy Book Holder Heavy Duty Bookends Nonskid Bookcase Desktop Book Organizer Binder Holder
mazon.com : Office Book Racks,MyGift Rustic Burnt Solid Wood Tabletop Book Holder Rack with Industrial Black Metal Frame Desktop Tilted Bookcase Reading Book Storage Organizer
mazon.com : Office Book Racks,Proman Products Renaissance Desktop Red Wood Book Rack Adjustable with Drawer 24 W x 8 D x 12 H Reddish Walnut
mazon.com : Office Book Racks,ASkinds Wooden Desktop Bookshelf DIY Book Storage Rack Student Bookcase DVD Rack Shelf Multifunctional Tabletop Organizer for Home Office
mazon.com : Office Book Racks,MyGift Barnwood Gray Wood Desktop Bookshelf Organizer Expandable Adjustable Display Shelf Book Rack
mazon.com : Office Book Racks,Desktop Bookshelf Desk 4-Tier Book Storage Organizer Shelves Tree Bookshelf Floor Standing Bookcase Wood Storage Rack for Office Home School Shelf Display Creative Bookcas (Blue)
mazon.com : Office Book Racks,gianotter office catalog racks Desk Organizers and Accessories Magazine File Holder for Office Supplies Desk Organizer with 5 Vertical Compartments (Gold)
mazon.com : Office Book Racks,Simple Trending Mesh Desktop File Sorter Organizer 5-Section Bookshelf for Desk Home Office Black
mazon.com : Office Book Racks,Rose Gold Shrinkable Metal Book Holder Triangle 7 Slot Desktop File Sorter Book Rack Organizer Art Desktop Magazine Holder for Office Home Decoration
mazon.com : Office Book Racks,DAWNYIELD 5-Tier Bookshelf Tall Standing Bookcase Metal &amp; Wood Shelving Unit for Storage Industrial Organizer Rack Modern Display Shelf Unit for Bedroom Living Room Study Home Office Retro Brown
mazon.com : Office Book Racks,Files Folder Stand Desktop File Organizer Vinyl Records Holder Book Shelf Magazine Rack 9 Slot File Sorter Eye-catching Decoration for Indoor Office Home Photograph Props (Diamond Black)
mazon.com : Office Book Racks,YITAHOME 5 Tiers Bookshelf Classically Modern Bookshelf Book Rack Storage Rack Shelves in Living Room/Home/Office Books Holder Organizer for Books/Movies - White
mazon.com : Office Book Racks,IRIS USA Wide 4 Pocket Magazine Rack Brown
mazon.com : Office Book Racks,Adjustable Bookends Metal Book Ends for Heavy Book Holder Heavy Duty Bookends Nonskid Bookcase Desktop Book Organizer Binder Holder (Blue)
mazon.com : Office Book Racks,Hoctieon 4 Tier Tree Bookshelf 4 Shelf Bookcase Free Standing Tree Bookcase Display Floor Standing Shelf for Books Book Organizer Shelves for Home Office Living Room Bedroom Black
mazon.com : Office Book Racks,Adjustable Bookends Book Holders for Shelves Metal Book Ends for Heavy Books Extends Up to 17 Inches Used in Office Desk and School (Black)
mazon.com : Office Book Racks,YITAHOME 73 Tall Narrow Bookshelf Modern Open 5 Tier Bookcase Wooden Shelf Stand for Small Spaces Display Shelving Storage Rack for Bedroom Living Room Home Office Black
mazon.com : Office Book Racks,YITAHOME 5 Tier Bookshelf Industrial Grey Bookcase Book Rack Decorative Storage Shelves in Bedroom/Living Room/Home Office Books Holder Organizer for Books Charcoal Gray + Black
mazon.com : Office Book Racks,Clear Stackable Paper Trays 4 Pack Desktop Racks PET Clear Desk Letter Tray Set Stackable Desk Organizer for Books Magazines Folders A4 Size File Paper Notes Pens (Clear)
mazon.com : Office Book Racks,Mindspace Desk Organizers and Accessories Desk Bookshelf - Home Office Accessories Desktop Organizer | Desk decor Office Supply Organizer Mail Organizer for Desk | The Wire Collection Chrome
mazon.com : Office Book Racks,Shintenchi 2 Pieces 5 Tiers Bookshelf Classically Tall Bookcase Shelf Industrial Book Rack Modern Book Holder in Bedroom/Living Room/Home/Office Storage Rack Shelves for Books/Movies-Gold
mazon.com : Office Book Racks,Shintenchi 5 Tiers Bookshelf Classically Tall Bookcase Shelf Industrial Book Rack Modern Book Holder in Bedroom/Living Room/Home/Office Storage Rack Shelves for Books/Movies Gold
mazon.com : Office Book Racks,Tajsoon Tree Bookshelf 3 Tier Book Storage Organizer Shelves Desktop Bookshelf Floor Standing Bookcase Display for CDs/Magazine/Books Small Bookshelf for Bedroom Living Room Office Rustic Brown
mazon.com : Office Book Racks,Pipishell 5-Tier Bookshelf Tall Bookcase Storage Shelf Organizer with Steel Frame Decorative Industrial Display Shelf Multipurpose Storage Rack for Bedroom Living Room Office Study Hallway
mazon.com : Office Book Racks,Vowcarol Book Organizer Clear File Sorter Large Slot Acrylic Desk Organizer Desktop File Folder Holder Organizer Office Storage Stand Rack for Book Envelopes Mail Document - 2 Pack
mazon.com : Office Book Racks,Godferyxin Book Tree Bookshelf 3-Tier Wood Bookshelf Tree Bookcase for Displaying Books CDs Magazines and More at Office Home or School
mazon.com : Office Book Racks,Keebofly Book Shelf Bookshelf 5-Tiers Book Shelf for Wall Magazine Holder Magazine Display Rack Vinyl Record Storage Bookcase Storage Organizer for Bedroom Living Room Office Kid Room Classroom
mazon.com : Office Book Racks,BOHDK Wall File Organizer Mesh Hanging File Organizer Durable Home Office Organization and Storage 3 Single Pockets Document Magazine Rack
mazon.com : Office Book Racks,Rotating Bookshelf 6 Tier 360° Floor Standing Revolving Bookcase Storage Rack Bookcase Corner Tall Book Shelf Narrow Bookshelf with Door Book Shelf Organizer for Bedroom Living Room Small Space
mazon.com : Office Book Racks,Storex Interlocking Book Bins 5 1/3 W x 14 1/3 L x 7 H 5 Color Set Plastic (70105U06C)
mazon.com : Office Book Racks,CAPHAUS 4 Tier Ladder Bookshelf 24 Inch Width Free Standing Shelf Bookcase Shelf Storage Rack Organizer Industrial Book Shelves for Home Office Living Room Kitchen Dark Grey Wooden Shelves
mazon.com : Office Book Racks,Adjustable Bookends Metal Book Ends for Heavy Book Holder Heavy Duty Bookends Nonskid Bookcase Desktop Book Organizer Binder Holder
mazon.com : Office Book Racks,ZRWD Tree Bookshelf 3-Tier Book Storage Organizer Shelves Floor Standing Bookcase Wood Storage Rack for Office Home School Shelf Display for Cd/Magazine（French Oak Grey）
mazon.com : Office Book Racks,EASEPRES 9 Slot Magazine Rack Book Record Holder Desktop Iron Storage Rack Bookshelf Multifunction Triangle File Organizer Sorter for Decor Home Office Black Pack of 2
mazon.com : Office Book Racks,6 Pcs File Magazine Organizer 3 x 11 x 12 Decorative Classic Books Themed Magazine Holder Box Easy to Assemble Classic Books Magazine Rack File for Shelves Desk Home Classroom Office (Elegant)
mazon.com : Office Book Racks,JOMOLA No Drilling File Holder Mail Organizer Wall Mount File Organizer Holder Office Wall Hanging Files Magazines Organizer Door Mount Wall Pocket Organizer with Adhesive Pad Off-white (1 Count)
mazon.com : Office Book Racks,Topfurny Tree Bookshelf 4-Tier Book Storage Organizer Shelves Floor Standing Bookcase Wood Storage Rack for Office Home School Shelf Display for Cd/Magazine/Book - Rustic Brown
mazon.com : Office Book Racks,Marte Vanci Clear Acrylic File Sorter Sturdy Desk File Organizer Shelf Book Holder Purse Handbag Clutch Divider File Folder Rack for Letter Cookbooks Home Office Kitchen Supplies 4 Sections (2 Pcs)
mazon.com : Office Book Racks,SUPER DEAL Industrial Ladder Shelf 4-Tier Bookcase Plant Book Display Furniture Storage Rack Shelf for Living Room Home Office Bedroom (Rustic Brown)
mazon.com : Office Book Racks,DALTACK Desk Organizers Metal Desk Magazine File Holder with 5 Vertical Compartments Folder Storage for Office Home School Organization Black
mazon.com : Office Book Racks,XOHYW 2 Pack Clear Acrylic Magazine Holder Wall Mount Hanging Bookshelf Literature Storage Rack Brochure File Display Shelf for Waiting Room Living Room Office Home
mazon.com : Office Book Racks,JIARI Book Organizer Magazine Holder Desktop File Sorter Organizer Bookshelf Bookends Book End Telescopic Bookend 7 Section (Black)
mazon.com : Office Book Racks,Fox Claw Wood Bookcase in Living Room/Home/Office Desktop Book Shelf Organizer Bookshelves Storage Rack for CDs/Magazine/Books Display (Style V)
mazon.com : Office Book Racks,RAD Cycle Products Adjustable Bike Trainer Fitness Desk Portable Workstation Standing Desk
mazon.com : Office Book Racks,C&amp;AHOME 7-Shelf Tree Bookshelf Bookcase Bamboo Book Rack Storage Shelves in Living Room Free-Standing Books Holder Organizer Space Saver for Home Office Kids Room Retro Brown
mazon.com : Office Book Racks,Mavivegue Book Shelf 12 Cube Storage Organizer DIY Bookcase Metal Cube Bookshelf Tall Book case for Bedroom Living Room Office Closet Storage Organizer Grey Cubicle Storage Rack
mazon.com : Office Book Racks,Versare Room Divider 360 Portable Wall Partition | Fully Assembled Room Divider Wall | Freestanding Office Dividers | Locking Wheels | Temporary Room Separator | 14 x 6 Cloud Gray Fabric Panels
mazon.com : Swing Chairs,Egg Swing Chair with Stand Rattan Wicker Hanging Egg Chair for Indoor Outdoor Bedroom Patio Hanging Basket Chair Hammock Egg Chair with Aluminum Steel Frame and UV Resistant Cushion 350lbs Capacity
mazon.com : Swing Chairs,NICESOUL® Indoor Outdoor Patio Wicker Hanging Egg Chair Swing Hammock Egg Chairs UV Resistant Cushions 350lbs Capaticy for Patio Bedroom Balcony (Grey)
mazon.com : Swing Chairs,Y- STOP Hammock Chair Hanging Rope Swing Max 500 Lbs 2 Cushions Included Large Macrame Hanging Chair with Pocket for Superior Comfort with Hardware Kit (Beige)
mazon.com : Swing Chairs,SONGMICS Hanging Chair Hammock Chair with Large Thick Cushion Boho Swing Chair for Bedroom Patio Balcony Garden Living Room Holds up to 264 lb Cloud White UGDC042M01
mazon.com : Swing Chairs,LFSMVT Light Up Kids Pod Swing Seat Kids Hanging Hammock Swing with LED Lights Sensory Pod Swing Chair with Inflatable Pillow &amp; All Accessories Pod Swing for Kids Indoor &amp; Outdoor (1 PCS) (Blue)
mazon.com : Swing Chairs,HBlife Hammock Chair Hanging Swing with Macrame and Cushion Max 330 Lbs Beige Hanging Cotton Rope Chair for Indoor Outdoor Bedroom Patio Yard Deck Garden and Porch
mazon.com : Swing Chairs,Y- STOP Hammock Chair Macrame Swing Hanging Cotton Rope Swing Chair with Cushion and Hardware Kits Max 330 Lbs Hanging Chairs for Indoor and Outdoor Use (White)
mazon.com : Swing Chairs,Brafab Egg Swing Chair Without Stand Outdoor Indoor Foldable Swing Chair Hanging Egg Chairs Aluminum Frame and UV Resistant Cushion Hammock Chair Swing Chair for Bedroom Patio Porch (Without Stand)
mazon.com : Swing Chairs,MoNiBloom Double Swing Chair with 3 Cushions for Outside Large Hanging Macrame Swing Chair for Indoor/Outdoor Relax Adult Hammock Boho Chair Max 700 lbs Capacity for Porch Balcony Backyard Beige
mazon.com : Swing Chairs,Best Choice Products Macramé Hanging Chair Handwoven Cotton Hammock Swing for Indoor &amp; Outdoor Use w/Mounting Hardware Backrest 265lb Capacity - Beige
mazon.com : Swing Chairs,Jelofly Hammock Chair Large Hanging Rope Swing Seat Chair with Pocket Max 350 Lbs Superior Comfortable for Indoor Outdoor Home Bedroom Garden Seat Cushions Not Included (Beige)
mazon.com : Swing Chairs,Outerman Hammock Chair Hanging Chair with 3 Cushions and Foot Rest Support Durable Metal Spreader Bar Max 500Lbs Swing Chair for Bedroom Indoor &amp; Outdoor Patio Porch or Tree（Black）…
mazon.com : Swing Chairs,KROFEM Macrame Hammock Hanging Swinging Chair with Medium Cushion Perfect for Bedroom Porch Kids Adults Balcony Beige
mazon.com : Swing Chairs,Hommtina Hammock Chair Hanging Rope Swing Max 300 Lbs Hanging Chair with Pocket- Quality Cotton Weave for Superior Comfort &amp; Durability Perfect for Outdoor Home Bedroom Patio Yard (Dark Gray)
mazon.com : Swing Chairs,DoubleTT Indoor/Outdoor Wicker Swing Egg Chair Hammock Hanging Chair Nest Basket with Stand UV Resistant Removable &amp; Washable Cushions 350LBS Capacity for Bedroom Balcony Garden (Yellow and Beige)
mazon.com : Swing Chairs,LEYCAY Egg Chair with Stand Hanging Egg Swing Hammock Chair with Stand Indoor Outdoor Wicker Egg Chair with Cushion Headrest for Patio Bedroom Porch Garden 350LBS Capacity(Dark Grey)
mazon.com : Swing Chairs,Chihee Hammock Chair Hanging Swing Max 500 Lbs 2 Cushions Included Steel Spreader Bar with Anti-Slip Grooves Portable Hanging Chair Side Pocket Large Macrame Bohemian Chair Indoor Outdoor
mazon.com : Swing Chairs,Gold Armour Hammock Chair Hanging Rope Swing Max 500lbs 2 Seat Cushions Included Hanging Chair with Pocket-Quality Cotton Weave for Superior Comfort &amp; Durability (Cream White)
mazon.com : Swing Chairs,NICESOUL® Swing Egg Chair with Stand Indoor Outdoor Wicker Rattan Patio Basket Hanging Chair with UV Resistant Cushions 350lbs Capaticy for Bedroom Balcony Patio (Cream)
mazon.com : Swing Chairs,Chihee Hammock Chair Super Large Hanging Soft-Spun Cotton Rope Weaving Chair Hardwood Spreader Bar Wide Seat Lace Swing Chair Indoor Outdoor Garden Yard Theme Decoration
mazon.com : Swing Chairs,Goutime Hammock Chair Macrame Hanging Swing Boho Chairs with Cushion and Hardware Kit Adult Swings for Outside Patio Porch Balcony Bedroom Gray
mazon.com : Swing Chairs,Hammock Chair with Stand Heavy-Duty Hanging Chair with Stand for Indoor Outdoor Sturdy Swing Chair with Stand Max Load 350 pounds…
mazon.com : Swing Chairs,Y- STOP Hammock Chair Hanging Rope Swing Chair Max 500 Lbs 2 Seat Cushions Included Removable Steel Spreader Bar with Anti-Slip Rings Hardware kit-for Indoor or Outdoor(Light Grey)
mazon.com : Swing Chairs,Hammock Chair Swing Hanging Chair for Bedroom Swing Chair for Indoor or Outdoor Max 500 Lbs 2 Cushions Included Large Macrame Hanging Chair with Pocket Easy to Assemble Hammock Swing Beige
mazon.com : Swing Chairs,Sensory Swing for Kids Indoor &amp; Outdoor Double Layer Therapy Cuddle Swing Hammock Chair with 360° Swivel Hanger Kit Adjustable Swing for Child and Adult with Aspergers Autism ADHD (Purple)
mazon.com : Swing Chairs,QF Hammock Chair Swing Hanging Hammock Chair - 2 Cushions Include - MAX 330lbs - Hammock Swing Seat Cotton for Patio Porch Bedroom Backyard Indoor or Outdoor (Rainbow)
